classification,subtitle,reported,issued,package_name,package_url,type,keywords,aliases,references,patched,description,unaffected,References
NA,Memory safety vulnerabilities arising fromError::type_id,"May 13, 2019","October  1, 2020",std,/packages/std.html,Vulnerability,memory-corruption,"{'text': 'https://groups.google.com/forum/#!topic/rustlang-security-announcements/aZabeCMUv70', 'url': 'https://groups.google.com/forum/#!topic/rustlang-security-announcements/aZabeCMUv70'}",>1.34.1,<1.34.0,"The Rust team was recently notified of a security vulnerability affecting
manual implementations ofError::type_idand their interaction with theError::downcastfamily of functions in the standard library. If your code
does not manually implementError::type_idyour code is not affected. TheError::type_idfunction in the standard library was stabilized in the
1.34.0 release on 2019-04-11. This function allows acquiring the concreteTypeIdfor the underlying error type to downcast back to the original type.
This function has a default implementation in the standard library, but it can
also be overridden by downstream crates. For example, the following is
currently allowed on Rust 1.34.0 and Rust 1.34.1: When combined with theError::downcast*family of methods this can enable
safe casting of a type to the wrong type, causing security issues such as out
of bounds reads/writes/etc. Prior to the 1.34.0 release this function was not stable and could not be
either implemented or called in stable Rust. TheError::type_idfunction was first stabilized in Rust 1.34.0, released on
2019-04-11. The Rust 1.34.1 release, published 2019-04-25, is also affected.
TheError::type_idfunction has been present, unstable, for all releases of
Rust since 1.0.0 meaning code compiled with nightly may have been affected at
any time. Immediate mitigation of this bug requires removing manual implementations ofError::type_id, instead inheriting the default implementation which is
correct from a safety perspective. It is not the intention to haveError::type_idreturnTypeIdinstances for other types. For long term mitigation we are going to destabilize this function. This is
unfortunately a breaking change for users callingError::type_idand for
users overridingError::type_id. For users overriding it's likely memory
unsafe, but users callingError::type_idhave only been able to do so on
stable for a few weeks since the last 1.34.0 release, so it's thought that the
impact will not be too great to overcome. We will be releasing a 1.34.2 point release on 2019-05-14 (tomorrow) which
reverts#58048and destabilizes theError::type_idfunction. The
upcoming 1.35.0 release along with the beta/nightly channels will also all be
updated with a destabilization. The final fate of theError::type_idAPI isn't decided upon just yet and is
the subject of#60784. No action beyond destabilization is currently
planned so nightly code may continue to exhibit this issue. We hope to fully
resolve this in the standard library soon. Thanks to Sean McArthur, who found this bug and reported it to us in accordance
with our security policy https://www.rust-lang.org/policies/security. Advisory available underCC0-1.0license."
NA,Cargo prior to Rust 1.26.0 may download the wrong dependency,"September 30, 2019","October  1, 2020",cargo,/packages/cargo.html,Vulnerability,"{'text': 'GHSA-phjm-8x66-qw4r', 'url': 'https://github.com/advisories/GHSA-phjm-8x66-qw4r'}","{'text': 'https://groups.google.com/forum/#!topic/rustlang-security-announcements/rVQ5e3TDnpQ', 'url': 'https://groups.google.com/forum/#!topic/rustlang-security-announcements/rVQ5e3TDnpQ'}",>=1.26.0,"The Rust team was recently notified of a security concern when using older
versions of Cargo to build crates which use the package rename feature added in
newer versions of Cargo. If you're using Rust 1.26.0, released on 2018-05-10,
or later you're not affected. The CVE for this vulnerability isCVE-2019-16760. Cargo can be configured throughCargo.tomland the[dependencies]section
to depend on different crates, such as those from crates.io. There are multiple
ways to configure how you depend on crates as well, for example if you depend
onserdeand enable thederivefeature it would look like: Rust 1.31.0introduced a new feature of Cargowhere one of the optional
keys you can specify in this map ispackage, a way torename a crate
locally. For example if you preferred to useserde1locally instead ofserde, you could write: It's the addition of thepackagekey that causes Cargo to compile the crate
differently. This feature wasfirst implementedin Rust 1.26.0, but it was
unstable at the time. For Rust 1.25.0 and prior, however, Cargo would ignore
thepackagekey and and interpret the dependency line as if it were: This means when compiled with Rust 1.25.0 and prior then it would attempt to
download theserde1crate. A malicious user could squat theserde1name on
crates.io to look likeserde 1.0.0but instead act maliciously when built. In summary, usage of thepackagekey to rename dependencies inCargo.tomlis ignored in Rust 1.25.0 and prior. When Rust 1.25.0 and prior is used Cargo
will ignorepackageand download the wrong dependency, which could be
squatted on crates.io to be a malicious package. This not only affects
manifests that you write locally yourself, but also manifests published to
crates.io. If you published a crate, for example, that depends onserde1to
crates.io then users who depend on you may also be vulnerable if they use Rust
1.25.0 and prior. Rust 1.0.0 through Rust 1.25.0 is affected by this advisory because Cargo will
ignore thepackagekey in manifests. Rust 1.26.0 through Rust 1.30.0 are not
affected and typically will emit an error because thepackagekey is
unstable. Rust 1.31.0 and after are not affected because Cargo understands thepackagekey. In terms of Cargo versions, this affects Cargo up through Cargo 0.26.0. All
future versions of Cargo are unaffected. We strongly recommend that users of the affected versions update their compiler
to the latest available one. Preventing this issue from happening requires
updating your compiler to either Rust 1.26.0 or newer. We will not be issuing a patch release for Rust versions prior to 1.26.0. Users
of Rust 1.19.0 to Rust 1.25.0 can instead applythe provided patchesto
mitigate the issue. An audit of existing crates published to crates.io using thepackagekey has
been performed and there is no evidence that this vulnerability has been
exploited in the wild. Our audit only covers the crates currently published on
crates.io: if you notice crates exploiting this vulnerability in the future
please don't hesitate to email secu...@rust-lang.org in accordance withour
security policy. Thanks to Elichai Turkel, who found this bug and reported it to us in accordance
with oursecurity policy. Advisory available underCC0-1.0license."
INFO,Use-after-free when setting the locale,"January 19, 2024","January 23, 2024",rust-i18n-support(crates.io),/packages/rust-i18n-support.html,INFOUnsound,memory-exposure,"{'text': 'https://github.com/longbridgeapp/rust-i18n/issues/71', 'url': 'https://github.com/longbridgeapp/rust-i18n/issues/71'}, {'text': 'https://github.com/longbridgeapp/rust-i18n/pull/72', 'url': 'https://github.com/longbridgeapp/rust-i18n/pull/72'}, {'text': 'https://github.com/longbridgeapp/rust-i18n/releases/tag/v3.0.1', 'url': 'https://github.com/longbridgeapp/rust-i18n/releases/tag/v3.0.1'}",>=3.0.1,<3.0.0,Version,"<3.0.1, >=3.0.0","Version 3.0.0 introduced anAtomicStrtype, that is used to store the current locale.
It stores the locale as a raw pointer to anArc<String>.
The locale can be read withAtomicStr::as_str().AtomicStr::as_str()does not increment the usage counter of theArc. If the locale is changed in one thread, another thread can have a stale -- possibly already freed --
reference to the stored string. Advisory available underCC0-1.0license.",rust_i18n_support;;atomicstr;;as_str,"<3.0.1, >=3.0.0"
INFO,Unsound sending of non-Send types across threads,"January  7, 2024","January 22, 2024",threadalone(crates.io),/packages/threadalone.html,INFOUnsound,"{'text': 'https://github.com/cr0sh/threadalone/issues/1', 'url': 'https://github.com/cr0sh/threadalone/issues/1'}",>=0.2.1,"Affected versions can run theDropimpl of a non-Send type on a different
thread than it was created on. The flaw occurs when a stderr write performed by thethreadalonecrate fails,
for example because stderr is redirected to a location on a filesystem that is
full, or because stderr is a pipe that has been closed by the reader. Dropping a non-Send type on the wrong thread is unsound. If used with a type
such as a pthread-basedMutexGuard,the consequence is undefined
behavior. If used withRc, there would be a data race on the
reference count, which is likewise undefined behavior. Advisory available underCC0-1.0license."
INFO,cosmwasmis unmaintained,"January 20, 2024","January 21, 2024",cosmwasm(crates.io),/packages/cosmwasm.html,INFOUnmaintained,"{'text': 'https://github.com/CosmWasm/cosmwasm/issues/1430', 'url': 'https://github.com/CosmWasm/cosmwasm/issues/1430'}",no patched versions,"The cratecosmwasmisnot used anymoresince spring 2020.
The functionality was split in multiple different crates, such as the standard librarycosmwasm-stdand the virtual machinecosmwasm-vm. An overview can be found in thecosmwasm repository. If you have this crate in your dependency tree, this is very likely by mistake and should be corrected. Advisory available underCC0-1.0license."
INFO,Unsound use of str::from_utf8_unchecked on bytes which are not UTF-8,"January 13, 2024","January 13, 2024",ferris-says(crates.io),/packages/ferris-says.html,INFOUnsound,"{'text': 'https://github.com/rust-lang/ferris-says/pull/21', 'url': 'https://github.com/rust-lang/ferris-says/pull/21'}",>=0.3.1,<=0.1.2,"Affected versions receive a&[u8]from the caller through a safe API, and pass
it directly to the unsafestr::from_utf8_uncheckedfunction. The behavior offerris_says::sayis undefined if the bytes from the caller
don't happen to be valid UTF-8. The flaw was corrected inferris-says#21by using the safestr::from_utf8instead, and returning an error on invalid input. However this fix has not yet
been published to crates.io as a patch version for 0.2. Separately,ferris-says#32has introduced a different API for version 0.3
which accepts input as&strrather than&[u8], so is unaffected by this bug. Advisory available underCC0-1.0license."
INFO,Potential stack use-after-free inInstrumented::into_inner,"October 19, 2023","January 13, 2024",tracing(crates.io),/packages/tracing.html,INFOUnsound,memory-corruption,,"{'text': 'https://github.com/tokio-rs/tracing/pull/2765', 'url': 'https://github.com/tokio-rs/tracing/pull/2765'}",>=0.1.40,<=0.1.37,Version,>=0.1.38<0.1.40,"The implementation of theInstrumented::into_innermethod in affected
versions of this crate contains undefined behavior due to incorrect use ofstd::mem::forgetThe function creates*constpointers toself, callsmem::forget(self), and then moves values out of those
pointers usingstd::ptr::read. However, themem::forgetdocumentationstates: This means that these pointers are no longer valid. This could result in a stack
use-after-free if LLVM chooses to reuseself's stack slot for a rebinding
after the call tostd::mem::forget. This undefined behavior has not been observed to cause miscompilation as of Rust
1.73.0. However, any use of this method with the affected versions oftracingare unsound. The flaw was corrected in commit20a1762(PR #2765) by replacing the use ofstd::mem::forgetwithstd::mem::ManuallyDrop, ensuring that the stack slot
is not reused and the pointers remain valid when they are read. The fix is
published intracingv0.1.40. Affected versions have been yanked from
crates.io. Thanks toTaylor CramerandManish Goregaokarfor finding and correcting
this issue! Advisory available underCC0-1.0license.",tracing;;instrument;;instrumented;;into_inner,>=0.1.38<0.1.40
INFO,Unaligned write of u64 on 32-bit and 16-bit platforms,"December 20, 2023","December 20, 2023",unsafe-libyaml(crates.io),/packages/unsafe-libyaml.html,INFOUnsound,,"{'text': 'https://github.com/dtolnay/unsafe-libyaml/issues/21', 'url': 'https://github.com/dtolnay/unsafe-libyaml/issues/21'}",>=0.2.10,"Affected versions allocate memory using the alignment ofusizeand write data
to it of typeu64, without usingcore::ptr::write_unaligned. In platforms
with sub-64bit alignment forusize(including wasm32 and x86) these writes
are insufficiently aligned some of the time. If using an ordinary optimized standard library, the bug exhibits Undefined
Behavior so may or may not behave in any sensible way, depending on
optimization settings and hardware and other things. If using a Rust standard
library built with debug assertions enabled, the bug manifests deterministically
in a crash (non-unwinding panic) saying""ptr::write requires that the pointer
argument is aligned and non-null"". No 64-bit platform is impacted by the bug. The flaw was corrected by allocating with adequately high alignment on all
platforms. Advisory available underCC0-1.0license."
INFO,cpythonis unmaintained,"November 14, 2023","December 20, 2023",cpython(crates.io),/packages/cpython.html,INFOUnmaintained,"{'text': 'https://github.com/dgrunwald/rust-cpython/commit/e815555', 'url': 'https://github.com/dgrunwald/rust-cpython/commit/e815555'}, {'text': 'https://github.com/dgrunwald/rust-cpython/issues/265', 'url': 'https://github.com/dgrunwald/rust-cpython/issues/265'}, {'text': 'https://github.com/dgrunwald/rust-cpython/issues/294', 'url': 'https://github.com/dgrunwald/rust-cpython/issues/294'}",no patched versions,"Thecpythoncrate and the underlyingpython3-sysandpython27-syscrates have been marked asno longer actively maintainedby the developer. There are also open issues for unsound code that is currently in these crates: Thepyo3crate is actively maintained. Preliminary support for Python 3.12 was added in version 0.19.2, and version 0.20.0 was released with full support for Python 3.12. Both versions implement string functions correctly on big-endian architectures. The endianness issue affecting thecpythoncrate was fixed in recent versions ofpyo3. Advisory available underCC0-1.0license."
INFO,opensslX509StoreRef::objectsis unsound,"November 23, 2023","November 28, 2023(last modified: December 20, 2023)",openssl(crates.io),/packages/openssl.html,INFOUnsound,memory-corruption,"{'text': 'https://github.com/sfackler/rust-openssl/issues/2096', 'url': 'https://github.com/sfackler/rust-openssl/issues/2096'}",>=0.10.60,Version,"<0.10.60, >=0.10.29","This function returned a shared reference into an OpenSSL datastructure but did not account for interior mutability. OpenSSL may modify the data behind this reference, meaning accesses can race and the reference is unsound. Use of this function should be replaced withX509StoreRef::all_certificates. Advisory available underCC0-1.0license.",openssl;;x509;;store;;x509storeref;;objects,"<0.10.60, >=0.10.29"
INFO,fehleris unmaintained; useculpainstead,"October 12, 2023","October 14, 2023",fehler(crates.io),/packages/fehler.html,INFOUnmaintained,"{'text': 'https://github.com/withoutboats/fehler/issues/66', 'url': 'https://github.com/withoutboats/fehler/issues/66'}",no patched versions,"Thefehlercrate is no longer maintained.
Consider usingculpainstead. Advisory available underCC0-1.0license."
INFO,Fails to prohibit standard library access prior to initialization of Rust standard library runtime,"September 10, 2023","September 10, 2023",inventory(crates.io),/packages/inventory.html,INFOUnsound,,"{'text': 'https://github.com/dtolnay/inventory/pull/43', 'url': 'https://github.com/dtolnay/inventory/pull/43'}",>=0.2.0,"Affected versions allow arbitrary caller-provided code to execute before the
lifetime ofmain. If the caller-provided code accesses particular pieces of the standard library
that require an initialized Rust runtime, such asstd::ioorstd::thread,
these may not behave as documented. Panics are likely; UB is possible. The flaw was corrected by enforcing that only code written within theinventorycrate, which is guaranteed not to access runtime-dependent parts of
the standard library, runs beforemain. Caller-provided code is restricted to
running at compile time. Advisory available underCC0-1.0license."
INFO,Exposes reference to non-Sync data to an arbitrary thread,"September 10, 2023","September 10, 2023",inventory(crates.io),/packages/inventory.html,INFOUnsound,thread-safety,,"{'text': 'https://github.com/dtolnay/inventory/pull/42', 'url': 'https://github.com/dtolnay/inventory/pull/42'}",>=0.2.0,"Affected versions do not enforce aSyncbound on the type of caller-provided
value held in the plugin registry. References to these values are made
accessible to arbitrary threads other than the one that constructed them. A caller could use this flaw to submit thread-unsafe data into inventory, then
access it as a reference simultaneously from multiple threads. The flaw was corrected by enforcing that data submitted by the caller into
inventory isSync. Advisory available underCC0-1.0license."
INFO,Unaligned read of*const *const c_charpointer,"September 10, 2023","September 10, 2023(last modified: September 12, 2023)",users(crates.io),/packages/users.html,INFOUnsound,,"{'text': 'https://github.com/ogham/rust-users/issues/55', 'url': 'https://github.com/ogham/rust-users/issues/55'}",no patched versions,"Affected versions dereference a potentially unaligned pointer. The pointer is
commonly unaligned in practice, resulting in undefined behavior. In some build modes, this is observable as a panic followed by abort. In other
build modes the UB may manifest in some other way, including the possibility of
working correctly in some architectures. The crate is not currently maintained, so a patched version is not available. Advisory available underCC0-1.0license."
INFO,Multiple soundness issues,"September  3, 2023","September  3, 2023",lexical(crates.io),/packages/lexical.html,INFOUnsound,"{'text': 'https://github.com/Alexhuszagh/rust-lexical/issues/102', 'url': 'https://github.com/Alexhuszagh/rust-lexical/issues/102'}, {'text': 'https://github.com/Alexhuszagh/rust-lexical/issues/101', 'url': 'https://github.com/Alexhuszagh/rust-lexical/issues/101'}, {'text': 'https://github.com/Alexhuszagh/rust-lexical/issues/95', 'url': 'https://github.com/Alexhuszagh/rust-lexical/issues/95'}, {'text': 'https://github.com/Alexhuszagh/rust-lexical/issues/104', 'url': 'https://github.com/Alexhuszagh/rust-lexical/issues/104'}",no patched versions,"lexicalcontains multiple soundness issues: The crate also has some correctness issues and appears to be unmaintained. For quickly parsing floating-point numbers third-party crates are no longer needed. A fast float parsing algorith by the author oflexicalhas beenmergedinto libcore. For quickly parsing integers, consideratoiandbtoicrates (100% safe code).atoi_radix10provides even faster parsing, but only with-C target-cpu=native, and at the cost of someunsafe. For formatting integers in a#[no_std]context consider thenumtoacrate. For working with big numbers considernum-bigintandnum-traits. Advisory available underCC0-1.0license."
INFO,dlopen_deriveis unmaintained,"July 30, 2023","August 19, 2023",dlopen_derive(crates.io),/packages/dlopen_derive.html,INFOUnmaintained,"{'text': 'https://github.com/szymonwieloch/rust-dlopen/issues/47', 'url': 'https://github.com/szymonwieloch/rust-dlopen/issues/47'}",no patched versions,"dlopen_derivehasn't been updated since June 9, 2019. dlopen_derivedepends onquote = ""0.6.12""andsyn = ""0.15.34"". Versions1.0.0of these dependencies were published on August 13, 2019. The0.*versions haven't received updates since. Note thatdlopenis an unmaintained crate from the same repository asdlopen_derive. However, migrating away fromdlopen_deriveimplies migrating away fromdlopen, as well. Advisory available underCC0-1.0license."
INFO,multipart is Unmaintained,"April 11, 2023","August 18, 2023",multipart(crates.io),/packages/multipart.html,INFOUnmaintained,no patched versions,"Themultipartcrate is unmaintained. The author has archived the github
repository. Alternatives: Advisory available underCC0-1.0license."
INFO,tuiis unmaintained; useratatuiinstead,"August  7, 2023","August  7, 2023",tui(crates.io),/packages/tui.html,INFOUnmaintained,"{'text': 'https://github.com/fdehau/tui-rs/issues/654', 'url': 'https://github.com/fdehau/tui-rs/issues/654'}",no patched versions,Thetuicrate is no longer maintained. Consider using theratatuicrate instead. Advisory available underCC0-1.0license.
INFO,Unsoundness ininternmethods onintagliosymbol interners,"July 26, 2023","July 27, 2023(last modified: July 29, 2023)",intaglio(crates.io),/packages/intaglio.html,INFOUnsound,"{'text': 'GHSA-gch5-hwqf-mxhp', 'url': 'https://github.com/advisories/GHSA-gch5-hwqf-mxhp'}","{'text': 'https://github.com/artichoke/intaglio/pull/236', 'url': 'https://github.com/artichoke/intaglio/pull/236'}, {'text': 'https://github.com/artichoke/intaglio/issues/235', 'url': 'https://github.com/artichoke/intaglio/issues/235'}, {'text': 'https://github.com/artichoke/intaglio/pull/236', 'url': 'https://github.com/artichoke/intaglio/pull/236'}, {'text': 'https://github.com/artichoke/intaglio/releases/tag/v1.9.0', 'url': 'https://github.com/artichoke/intaglio/releases/tag/v1.9.0'}",>=1.9.0,Version,<1.9.0,<1.9.0,"<1.9.0, >=1.5.0","<1.9.0, >=1.5.0","<1.9.0, >=1.5.0","Affected versions of this crate have a stacked borrows violation when creating
references to interned contents. All interner types are affected. The flaw was corrected in version 1.9.0 by reordering move and borrowing
operations and storing interned contents by raw pointer instead of as aBox. Advisory available underCC0-1.0license.",intaglio;;symboltable;;intern,<1.9.0
INFO,implFromMdbValuefor bool is unsound,"June 26, 2023","July 18, 2023(last modified: July 29, 2023)",lmdb-rs(crates.io),/packages/lmdb-rs.html,INFOUnsound,,"{'text': 'GHSA-f9g6-fp84-fv92', 'url': 'https://github.com/advisories/GHSA-f9g6-fp84-fv92'}","{'text': 'https://github.com/vhbit/lmdb-rs/issues/67', 'url': 'https://github.com/vhbit/lmdb-rs/issues/67'}",no patched versions,"The implementation ofFromMdbValuehave several unsoundness issues. First of all, it allows to reinterpret arbitrary bytes as a bool and could make undefined behavior happen with safe function. Secondly, it allows transmuting pointer without taking memory layout into consideration. The details of reproducing the bug were included in url above. Advisory available underCC0-1.0license."
INFO,Misaligned pointer dereference inChunkId::new,"June 15, 2023","June 22, 2023(last modified: July  8, 2023)",cyfs-base(crates.io),/packages/cyfs-base.html,INFOUnsound,,"{'text': 'GHSA-g753-ghr7-q33w', 'url': 'https://github.com/advisories/GHSA-g753-ghr7-q33w'}","{'text': 'https://github.com/buckyos/CYFS/issues/275', 'url': 'https://github.com/buckyos/CYFS/issues/275'}",no patched versions,"The functionChunkId::newcreates a misaligned pointer by casting mutable pointer ofu8slice which has alignment 1 to the mutable pointer ofu32which has alignment 4, and dereference the misaligned pointer leading UB, which should not be allowed in safe function. Advisory available underCC0-1.0license."
INFO,memoffset allows reading uninitialized memory,"June 21, 2023","June 21, 2023(last modified: July  8, 2023)",memoffset(crates.io),/packages/memoffset.html,INFOUnsound,memory-corruption,,"{'text': 'GHSA-wfg4-322g-9vqv', 'url': 'https://github.com/advisories/GHSA-wfg4-322g-9vqv'}","{'text': 'https://github.com/Gilnaa/memoffset/issues/24', 'url': 'https://github.com/Gilnaa/memoffset/issues/24'}",>=0.6.2,Version,<0.6.2,"memoffset allows attempt of reading data from address0with arbitrary type. This behavior is an undefined behavior because address0tostd::mem::size_of<T>may not have valid bit-pattern withT. Old implementation dereferences uninitialized memory obtained fromstd::mem::align_of. Older implementation prior to it allows using uninitialized data obtained fromstd::mem::uninitializedwith arbitrary type then compute offset by taking the address of field-projection. This may also result in an undefined behavior for ""father"" that includes (directly or transitively) type thatdoes not allow to be uninitialized. This flaw was corrected by usingstd::ptr::addr_ofinhttps://github.com/Gilnaa/memoffset/pull/50. Advisory available underCC0-1.0license.",memoffset;;offset_of,<0.6.2
INFO,"ftp is unmaintained, use suppaftp instead","February 20, 2023","June 14, 2023",ftp(crates.io),/packages/ftp.html,INFOUnmaintained,,"{'text': 'https://github.com/mattnenterprise/rust-ftp/pull/92', 'url': 'https://github.com/mattnenterprise/rust-ftp/pull/92'}, {'text': 'https://github.com/mattnenterprise/rust-ftp/issues/91', 'url': 'https://github.com/mattnenterprise/rust-ftp/issues/91'}, {'text': 'https://github.com/mattnenterprise/rust-ftp/issues/84', 'url': 'https://github.com/mattnenterprise/rust-ftp/issues/84'}",no patched versions,"Theftpcrate is not maintained any more;
usesuppaftpinstead. Advisory available underCC0-1.0license."
