classification,subtitle,reported,issued,package_name,package_url,type,keywords,aliases,references,patched,description,unaffected,References
HIGH,AtomicBoximplements Send/Sync for anyT: Sized,"November 10, 2020","January 25, 2021(last modified: June 13, 2023)",abox(crates.io),/packages/abox.html,Vulnerability,"memory-corruption, thread-safety","{'text': 'CVE-2020-36441', 'url': 'https://cve.mitre.org/cgi-bin/cvename.cgi?name=CVE-2020-36441'}, {'text': 'GHSA-r626-fc64-3q28', 'url': 'https://github.com/advisories/GHSA-r626-fc64-3q28'}","{'text': 'https://github.com/SonicFrog/abox/issues/1', 'url': 'https://github.com/SonicFrog/abox/issues/1'}",8.1HIGH,Network,HighPrivileges requiredNoneUser interactionNoneScopeUnchangedConfidentialityHighIntegrityHighAvailabilityHigh,None,None,Unchanged,High,High,High,Network,HighPrivileges requiredNoneUser interactionNoneScopeUnchangedConfidentialityHighIntegrityHighAvailabilityHigh,None,None,Unchanged,High,High,High,CVSS:3.1/AV:N/AC:H/PR:N/UI:N/S:U/C:H/I:H/A:H,>=0.4.1,"Affected versions of this crate implementsSend/SyncforAtomicBox<T>without requiringT: Send/T: Sync. This allows to create data races toT: !Syncand sendT: !Sendto another thread. Such behavior breaks the compile-time thread safety guarantees of Rust, and allows users to incur undefined behavior using safe Rust (e.g. memory corruption from data race). The flaw was corrected in commit 34c2b9e by adding trait boundT: SendtoSendimpl forAtomicBox<T>and trait boundT: SynctoSyncimpl forAtomicBox<T>. Advisory available underCC0-1.0license."
HIGH,QueueSender/QueueReceiver: Send/Sync impls needT: Send,"November 24, 2020","January 24, 2021(last modified: June 13, 2023)",conqueue(crates.io),/packages/conqueue.html,Vulnerability,"memory-corruption, thread-safety","{'text': 'CVE-2020-36437', 'url': 'https://cve.mitre.org/cgi-bin/cvename.cgi?name=CVE-2020-36437'}, {'text': 'GHSA-368f-29c3-4f2r', 'url': 'https://github.com/advisories/GHSA-368f-29c3-4f2r'}","{'text': 'https://github.com/longshorej/conqueue/issues/9', 'url': 'https://github.com/longshorej/conqueue/issues/9'}",8.1HIGH,Network,HighPrivileges requiredNoneUser interactionNoneScopeUnchangedConfidentialityHighIntegrityHighAvailabilityHigh,None,None,Unchanged,High,High,High,Network,HighPrivileges requiredNoneUser interactionNoneScopeUnchangedConfidentialityHighIntegrityHighAvailabilityHigh,None,None,Unchanged,High,High,High,CVSS:3.1/AV:N/AC:H/PR:N/UI:N/S:U/C:H/I:H/A:H,>=0.4.0,"Affected versions of this crate unconditionally implementedSend/SyncforQueueSender<T>,
allowing to send non-SendTto other threads by invoking(&QueueSender<T>).send(). This fails to prevent users from creating data races by sending types likeRc<T>orArc<Cell<T>>to other threads, which can lead to memory corruption. The flaw was corrected in commit 1e462c3 by imposingT: Sendto bothSend/Syncimpls forQueueSender<T>/QueueReceiver<T>. Advisory available underCC0-1.0license."
HIGH,Futurelacks bounds on Send and Sync.,"December  8, 2020","January 24, 2021(last modified: June 13, 2023)",tiny_future(crates.io),/packages/tiny_future.html,Vulnerability,"memory-corruption, thread-safety",,"{'text': 'CVE-2020-36438', 'url': 'https://cve.mitre.org/cgi-bin/cvename.cgi?name=CVE-2020-36438'}, {'text': 'GHSA-fg42-vwxx-xx5j', 'url': 'https://github.com/advisories/GHSA-fg42-vwxx-xx5j'}, {'text': 'GHSA-m296-j53x-xv95', 'url': 'https://github.com/advisories/GHSA-m296-j53x-xv95'}","{'text': 'https://github.com/KizzyCode/tiny_future/issues/1', 'url': 'https://github.com/KizzyCode/tiny_future/issues/1'}",8.1HIGH,Network,HighPrivileges requiredNoneUser interactionNoneScopeUnchangedConfidentialityHighIntegrityHighAvailabilityHigh,None,None,Unchanged,High,High,High,Network,HighPrivileges requiredNoneUser interactionNoneScopeUnchangedConfidentialityHighIntegrityHighAvailabilityHigh,None,None,Unchanged,High,High,High,CVSS:3.1/AV:N/AC:H/PR:N/UI:N/S:U/C:H/I:H/A:H,>=0.4.0,tiny_futurecontains a light-weight implementation ofFutures. TheFuturetype it has lacked bound on itsSendandSynctraits. This allows for a bug where non-thread safe types such asCellcan be used inFutures and cause data races in concurrent programs. The flaw was corrected in commitc791919by adding trait bounds toFuture'sSendandSync. Advisory available underCC0-1.0license.
HIGH,"PinSlaband Unordered<T, S> need bounds on their Send/Sync traits","November 15, 2020","January 24, 2021(last modified: June 13, 2023)",unicycle(crates.io),/packages/unicycle.html,Vulnerability,"memory-corruption, thread-safety","{'text': 'CVE-2020-36436', 'url': 'https://cve.mitre.org/cgi-bin/cvename.cgi?name=CVE-2020-36436'}, {'text': 'GHSA-686f-ch3r-xwmh', 'url': 'https://github.com/advisories/GHSA-686f-ch3r-xwmh'}","{'text': 'https://github.com/udoprog/unicycle/issues/8', 'url': 'https://github.com/udoprog/unicycle/issues/8'}",8.1HIGH,Network,HighPrivileges requiredNoneUser interactionNoneScopeUnchangedConfidentialityHighIntegrityHighAvailabilityHigh,None,None,Unchanged,High,High,High,Network,HighPrivileges requiredNoneUser interactionNoneScopeUnchangedConfidentialityHighIntegrityHighAvailabilityHigh,None,None,Unchanged,High,High,High,CVSS:3.1/AV:N/AC:H/PR:N/UI:N/S:U/C:H/I:H/A:H,>=0.7.1,"Affected versions of this crate unconditionally implementedSend&Syncfor typesPinSlab<T>&Unordered<T, S>. This allows sending non-Send types to other threads and concurrently accessing non-Sync types from multiple threads. This can result in a data race & memory corruption when types that provide internal mutability without synchronization are contained withinPinSlab<T>orUnordered<T, S>and accessed concurrently from multiple threads. The flaw was corrected in commits 92f40b4 & 6a6c367 by adding trait boundT: SendtoSendimpls forPinSlab<T>&Unordered<T, S>and addingT: SynctoSyncimpls forPinSlab<T>&Unordered<T, S>. Advisory available underCC0-1.0license."
HIGH,Singleton lacks bounds on Send and Sync.,"November 16, 2020","January 22, 2021(last modified: June 13, 2023)",ruspiro-singleton(crates.io),/packages/ruspiro-singleton.html,Vulnerability,"memory-corruption, thread-safety",,"{'text': 'CVE-2020-36435', 'url': 'https://cve.mitre.org/cgi-bin/cvename.cgi?name=CVE-2020-36435'}, {'text': 'GHSA-fqq2-xp7m-xvm8', 'url': 'https://github.com/advisories/GHSA-fqq2-xp7m-xvm8'}","{'text': 'https://github.com/RusPiRo/ruspiro-singleton/issues/10', 'url': 'https://github.com/RusPiRo/ruspiro-singleton/issues/10'}",8.1HIGH,Network,HighPrivileges requiredNoneUser interactionNoneScopeUnchangedConfidentialityHighIntegrityHighAvailabilityHigh,None,None,Unchanged,High,High,High,Network,HighPrivileges requiredNoneUser interactionNoneScopeUnchangedConfidentialityHighIntegrityHighAvailabilityHigh,None,None,Unchanged,High,High,High,CVSS:3.1/AV:N/AC:H/PR:N/UI:N/S:U/C:H/I:H/A:H,>=0.4.1,"Singleton<T>is meant to be a static object that can be initialized lazily. In
order to satisfy the requirement thatstaticitems must implementSync,Singletonimplemented bothSyncandSendunconditionally. This allows for a bug where non-Synctypes such asCellcan be used in
singletons and cause data races in concurrent programs. The flaw was corrected in commitb0d2bd20eby adding trait bounds, requiring
the contaiend type to implementSync. Advisory available underCC0-1.0license."
HIGH,conquer-once's OnceCell lacks Send bound for its Sync trait.,"December 22, 2020","January 20, 2021(last modified: June 13, 2023)",conquer-once(crates.io),/packages/conquer-once.html,Vulnerability,"memory-corruption, thread-safety",,"{'text': 'CVE-2020-36208', 'url': 'https://cve.mitre.org/cgi-bin/cvename.cgi?name=CVE-2020-36208'}, {'text': 'GHSA-3jc5-5hc5-33gj', 'url': 'https://github.com/advisories/GHSA-3jc5-5hc5-33gj'}","{'text': 'https://github.com/oliver-giersch/conquer-once/issues/3', 'url': 'https://github.com/oliver-giersch/conquer-once/issues/3'}",7.8HIGH,Local,LowPrivileges requiredLowUser interactionNoneScopeUnchangedConfidentialityHighIntegrityHighAvailabilityHigh,Low,None,Unchanged,High,High,High,Local,LowPrivileges requiredLowUser interactionNoneScopeUnchangedConfidentialityHighIntegrityHighAvailabilityHigh,Low,None,Unchanged,High,High,High,CVSS:3.1/AV:L/AC:L/PR:L/UI:N/S:U/C:H/I:H/A:H,>=0.3.2,"Affected versions ofconquer-onceimplementsSyncfor itsOnceCelltype
without restricting it toSendable types. This allows non-SendbutSynctypes such asMutexGuardto be sent across
threads leading to undefined behavior and memory corruption in concurrent
programs. The issue was fixed by adding aSendconstraint toOnceCell. Advisory available underCC0-1.0license."
HIGH,LateStatic has incorrect Sync bound,"November 10, 2020","January 20, 2021(last modified: June 13, 2023)",late-static(crates.io),/packages/late-static.html,Vulnerability,"memory-corruption, thread-safety","{'text': 'CVE-2020-36209', 'url': 'https://cve.mitre.org/cgi-bin/cvename.cgi?name=CVE-2020-36209'}, {'text': 'GHSA-wr55-mf5c-hhwm', 'url': 'https://github.com/advisories/GHSA-wr55-mf5c-hhwm'}","{'text': 'https://github.com/Richard-W/late-static/issues/1', 'url': 'https://github.com/Richard-W/late-static/issues/1'}",7HIGH,Local,HighPrivileges requiredLowUser interactionNoneScopeUnchangedConfidentialityHighIntegrityHighAvailabilityHigh,Low,None,Unchanged,High,High,High,Local,HighPrivileges requiredLowUser interactionNoneScopeUnchangedConfidentialityHighIntegrityHighAvailabilityHigh,Low,None,Unchanged,High,High,High,CVSS:3.1/AV:L/AC:H/PR:L/UI:N/S:U/C:H/I:H/A:H,>=0.4.0,"Affected versions of this crate implementedSyncforLateStaticwithT: Send, so that it is possible to create a data race to a typeT: Send + !Sync(e.g.Cell<T>). This can result in a memory corruption or other kinds of undefined behavior. The flaw was corrected in commit 11f396c by replacing theT: Sendbound toT: Syncbound in theSyncimpl forLateStatic<T>. Advisory available underCC0-1.0license."
HIGH,"panic safety issue inimpl TransformContent<S, D> for [S; (2|3|4)]","January 10, 2021","January 20, 2021(last modified: June 13, 2023)",basic_dsp_matrix(crates.io),/packages/basic_dsp_matrix.html,Vulnerability,memory-corruption,"{'text': 'CVE-2021-25906', 'url': 'https://cve.mitre.org/cgi-bin/cvename.cgi?name=CVE-2021-25906'}, {'text': 'GHSA-fjr6-hm39-4cf9', 'url': 'https://github.com/advisories/GHSA-fjr6-hm39-4cf9'}","{'text': 'https://github.com/liebharc/basic_dsp/issues/47', 'url': 'https://github.com/liebharc/basic_dsp/issues/47'}",7.5HIGH,Network,LowPrivileges requiredNoneUser interactionNoneScopeUnchangedConfidentialityNoneIntegrityNoneAvailabilityHigh,None,None,Unchanged,None,None,High,Network,LowPrivileges requiredNoneUser interactionNoneScopeUnchangedConfidentialityNoneIntegrityNoneAvailabilityHigh,None,None,Unchanged,None,None,High,CVSS:3.1/AV:N/AC:L/PR:N/UI:N/S:U/C:N/I:N/A:H,>=0.9.2,"Affected versions of this crate did not guard against double drop while temporarily duplicating objects' ownership usingptr::read(). Upon panic in a user-provided functionconversion, objects that are copied byptr::read()are dropped twice, leading to memory corruption. The flaw was corrected in v0.9.2 by usingManuallyDrop<T>to enclose objects that are to be temporarily duplicated. Advisory available underCC0-1.0license."
HIGH,ImageChunkMut needs bounds on its Send and Sync traits,"December  8, 2020","January 20, 2021(last modified: June 13, 2023)",gfwx(crates.io),/packages/gfwx.html,Vulnerability,"memory-corruption, thread-safety","{'text': 'CVE-2020-36211', 'url': 'https://cve.mitre.org/cgi-bin/cvename.cgi?name=CVE-2020-36211'}, {'text': 'GHSA-xp6v-qx65-4pp7', 'url': 'https://github.com/advisories/GHSA-xp6v-qx65-4pp7'}","{'text': 'https://github.com/Devolutions/gfwx-rs/issues/7', 'url': 'https://github.com/Devolutions/gfwx-rs/issues/7'}",7HIGH,Local,HighPrivileges requiredLowUser interactionNoneScopeUnchangedConfidentialityHighIntegrityHighAvailabilityHigh,Low,None,Unchanged,High,High,High,Local,HighPrivileges requiredLowUser interactionNoneScopeUnchangedConfidentialityHighIntegrityHighAvailabilityHigh,Low,None,Unchanged,High,High,High,CVSS:3.1/AV:L/AC:H/PR:L/UI:N/S:U/C:H/I:H/A:H,>=0.3.0,"In the affected versions of this crate,ImageChunkMut<'_, T>unconditionally implementsSendandSync, allowing to create data races. This can result in a memory corruption or undefined behavior when non thread-safe types are moved and referenced across thread boundaries. The flaw was corrected in commit e7fb2f5 by addingT: Sendbound to theSendimpl and addingT: Syncbound to theSyncimpl. Advisory available underCC0-1.0license."
HIGH,Update unsound DrainFilter and RString::retain,"December 21, 2020","January 20, 2021(last modified: June 13, 2023)",abi_stable(crates.io),/packages/abi_stable.html,Vulnerability,memory-corruption,"{'text': 'CVE-2020-36212', 'url': 'https://cve.mitre.org/cgi-bin/cvename.cgi?name=CVE-2020-36212'}, {'text': 'CVE-2020-36213', 'url': 'https://cve.mitre.org/cgi-bin/cvename.cgi?name=CVE-2020-36213'}, {'text': 'GHSA-vq23-5h4f-vwpv', 'url': 'https://github.com/advisories/GHSA-vq23-5h4f-vwpv'}, {'text': 'GHSA-wqxc-qrq4-w5v4', 'url': 'https://github.com/advisories/GHSA-wqxc-qrq4-w5v4'}","{'text': 'https://github.com/rodrimati1992/abi_stable_crates/issues/44', 'url': 'https://github.com/rodrimati1992/abi_stable_crates/issues/44'}",7.5HIGH,Network,LowPrivileges requiredNoneUser interactionNoneScopeUnchangedConfidentialityNoneIntegrityNoneAvailabilityHigh,None,None,Unchanged,None,None,High,Network,LowPrivileges requiredNoneUser interactionNoneScopeUnchangedConfidentialityNoneIntegrityNoneAvailabilityHigh,None,None,Unchanged,None,None,High,CVSS:3.1/AV:N/AC:L/PR:N/UI:N/S:U/C:N/I:N/A:H,>=0.9.1,Affected versions of this crate contained code from the Rust standard library that contained soundness bugs rust-lang/rust#60977 (double drop) & rust-lang/rust#78498 (create invalid utf-8 string). The flaw was corrected in v0.9.1 by making a similar fix to the one made in the Rust standard library. Advisory available underCC0-1.0license.
HIGH,impl Randomon arrays can lead to dropping uninitialized memory,"December 31, 2020","January 20, 2021(last modified: June 13, 2023)",autorand(crates.io),/packages/autorand.html,Vulnerability,memory-corruption,"{'text': 'CVE-2020-36210', 'url': 'https://cve.mitre.org/cgi-bin/cvename.cgi?name=CVE-2020-36210'}, {'text': 'GHSA-cgmg-2v6m-fjg7', 'url': 'https://github.com/advisories/GHSA-cgmg-2v6m-fjg7'}","{'text': 'https://github.com/mersinvald/autorand-rs/issues/5', 'url': 'https://github.com/mersinvald/autorand-rs/issues/5'}",7.8HIGH,Local,LowPrivileges requiredLowUser interactionNoneScopeUnchangedConfidentialityHighIntegrityHighAvailabilityHigh,Low,None,Unchanged,High,High,High,Local,LowPrivileges requiredLowUser interactionNoneScopeUnchangedConfidentialityHighIntegrityHighAvailabilityHigh,Low,None,Unchanged,High,High,High,CVSS:3.1/AV:L/AC:L/PR:L/UI:N/S:U/C:H/I:H/A:H,>=0.2.3,Affected versions of this crate had a panic safety issue to drop partially uninitialized array ofTupon panic in a user provided functionT::random(). Dropping uninitializedTcan potentially cause memory corruption or undefined behavior. The flaw was corrected in commit 565d508 by usingMaybeUninit<T>to avoid possible dropping of uninitialized memory upon panic. Advisory available underCC0-1.0license.
HIGH,EventList's Fromconversions can double drop on panic.,"January  4, 2021","January 20, 2021(last modified: June 13, 2023)",fil-ocl(crates.io),/packages/fil-ocl.html,Vulnerability,memory-corruption,,"{'text': 'CVE-2021-25908', 'url': 'https://cve.mitre.org/cgi-bin/cvename.cgi?name=CVE-2021-25908'}, {'text': 'GHSA-x3v2-fgr6-3wmm', 'url': 'https://github.com/advisories/GHSA-x3v2-fgr6-3wmm'}","{'text': 'https://github.com/cogciprocate/ocl/issues/194', 'url': 'https://github.com/cogciprocate/ocl/issues/194'}",7.5HIGH,Network,LowPrivileges requiredNoneUser interactionNoneScopeUnchangedConfidentialityNoneIntegrityNoneAvailabilityHigh,None,None,Unchanged,None,None,High,Network,LowPrivileges requiredNoneUser interactionNoneScopeUnchangedConfidentialityNoneIntegrityNoneAvailabilityHigh,None,None,Unchanged,None,None,High,CVSS:3.1/AV:N/AC:L/PR:N/UI:N/S:U/C:N/I:N/A:H,no patched versions,<0.12.0,"Affected versions of this crate read from a container usingptr::readinFrom<EventList>, and then call a user specifiedInto<Event>function. This issue can result in a double-free if the user provided function panics. Advisory available underCC0-1.0license."
HIGH,hashconsing's HConsed lacks Send/Sync bound for its Send/Sync trait.,"November 10, 2020","January 20, 2021(last modified: June 13, 2023)",hashconsing(crates.io),/packages/hashconsing.html,Vulnerability,"memory-corruption, thread-safety",,"{'text': 'CVE-2020-36215', 'url': 'https://cve.mitre.org/cgi-bin/cvename.cgi?name=CVE-2020-36215'}, {'text': 'GHSA-rw2c-c256-3r53', 'url': 'https://github.com/advisories/GHSA-rw2c-c256-3r53'}","{'text': 'https://github.com/AdrienChampion/hashconsing/issues/1', 'url': 'https://github.com/AdrienChampion/hashconsing/issues/1'}",7.5HIGH,Network,LowPrivileges requiredNoneUser interactionNoneScopeUnchangedConfidentialityNoneIntegrityNoneAvailabilityHigh,None,None,Unchanged,None,None,High,Network,LowPrivileges requiredNoneUser interactionNoneScopeUnchangedConfidentialityNoneIntegrityNoneAvailabilityHigh,None,None,Unchanged,None,None,High,CVSS:3.1/AV:N/AC:L/PR:N/UI:N/S:U/C:N/I:N/A:H,>=1.1.0,Affected versions ofhashconsingimplementsSend/Syncfor itsHConsedtype without restricting it toSendable types andSyncable types. This allows non-Synctypes such asCellto be shared across threads leading to undefined behavior and memory corruption in concurrent programs. Advisory available underCC0-1.0license.
HIGH,Aoveclacks bound on its Send and Sync traits allowing data races,"December 10, 2020","January 19, 2021(last modified: June 13, 2023)",aovec(crates.io),/packages/aovec.html,Vulnerability,"memory-corruption, thread-safety",,"{'text': 'CVE-2020-36207', 'url': 'https://cve.mitre.org/cgi-bin/cvename.cgi?name=CVE-2020-36207'}, {'text': 'GHSA-g489-xrw3-3v8w', 'url': 'https://github.com/advisories/GHSA-g489-xrw3-3v8w'}",7HIGH,Local,HighPrivileges requiredLowUser interactionNoneScopeUnchangedConfidentialityHighIntegrityHighAvailabilityHigh,Low,None,Unchanged,High,High,High,Local,HighPrivileges requiredLowUser interactionNoneScopeUnchangedConfidentialityHighIntegrityHighAvailabilityHigh,Low,None,Unchanged,High,High,High,CVSS:3.1/AV:L/AC:H/PR:L/UI:N/S:U/C:H/I:H/A:H,no patched versions,"aovec::Aovec<T>is a vector type that implementsSendandSyncfor all
typesT. This allows non-Send types such asRcand non-Sync types such asCellto
be used across thread boundaries which can trigger undefined behavior and
memory corruption. Advisory available underCC0-1.0license."
HIGH,Exposes internally used raw pointer,"January  1, 2021","January 19, 2021(last modified: June 13, 2023)",cache(crates.io),/packages/cache.html,INFOUnsound,memory-corruption,,"{'text': 'CVE-2021-25903', 'url': 'https://cve.mitre.org/cgi-bin/cvename.cgi?name=CVE-2021-25903'}, {'text': 'GHSA-gh87-6jr3-8q47', 'url': 'https://github.com/advisories/GHSA-gh87-6jr3-8q47'}","{'text': 'https://github.com/krl/cache/issues/2', 'url': 'https://github.com/krl/cache/issues/2'}",7.5HIGH,Network,LowPrivileges requiredNoneUser interactionNoneScopeUnchangedConfidentialityNoneIntegrityNoneAvailabilityHigh,None,None,Unchanged,None,None,High,Network,LowPrivileges requiredNoneUser interactionNoneScopeUnchangedConfidentialityNoneIntegrityNoneAvailabilityHigh,None,None,Unchanged,None,None,High,CVSS:3.1/AV:N/AC:L/PR:N/UI:N/S:U/C:N/I:N/A:H,no patched versions,"Affected versions of this crate dereference a raw pointer that can be modified
without usingunsafecode. Advisory available underCC0-1.0license."
HIGH,Frame::copy_from_raw_partscan lead to segfault withoutunsafe,"January  7, 2021","January 19, 2021(last modified: June 13, 2023)",av-data(crates.io),/packages/av-data.html,Vulnerability,"memory-exposure, privilege-escalation","{'text': 'CVE-2021-25904', 'url': 'https://cve.mitre.org/cgi-bin/cvename.cgi?name=CVE-2021-25904'}, {'text': 'GHSA-352p-rhvq-7g78', 'url': 'https://github.com/advisories/GHSA-352p-rhvq-7g78'}","{'text': 'https://github.com/rust-av/rust-av/issues/136', 'url': 'https://github.com/rust-av/rust-av/issues/136'}",7.5HIGH,Network,LowPrivileges requiredNoneUser interactionNoneScopeUnchangedConfidentialityNoneIntegrityNoneAvailabilityHigh,None,None,Unchanged,None,None,High,Network,LowPrivileges requiredNoneUser interactionNoneScopeUnchangedConfidentialityNoneIntegrityNoneAvailabilityHigh,None,None,Unchanged,None,None,High,CVSS:3.1/AV:N/AC:L/PR:N/UI:N/S:U/C:N/I:N/A:H,>=0.3.0,"fn Frame::copy_from_raw_parts()is a safe API that can take a
raw pointer and dereference it. It is possible to read arbitrary memory address
with an arbitrarily fed pointer. This allows the safe API to access & read
arbitrary address in memory. Feeding an invalid memory address pointer to
the API may also cause the program to segfault. The flaw was corrected in https://github.com/rust-av/rust-av/pull/137,
by removing the APIfn Frame::copy_from_raw_parts(). Advisory available underCC0-1.0license."
HIGH,UsbContext trait did not require implementers to be Send and Sync.,"December 18, 2020","January 18, 2021(last modified: June 13, 2023)",rusb(crates.io),/packages/rusb.html,INFOUnsound,"memory-corruption, thread-safety",,"{'text': 'CVE-2020-36206', 'url': 'https://cve.mitre.org/cgi-bin/cvename.cgi?name=CVE-2020-36206'}, {'text': 'GHSA-9mxw-4856-9cm5', 'url': 'https://github.com/advisories/GHSA-9mxw-4856-9cm5'}","{'text': 'https://github.com/a1ien/rusb/issues/44', 'url': 'https://github.com/a1ien/rusb/issues/44'}",7HIGH,Local,HighPrivileges requiredLowUser interactionNoneScopeUnchangedConfidentialityHighIntegrityHighAvailabilityHigh,Low,None,Unchanged,High,High,High,Local,HighPrivileges requiredLowUser interactionNoneScopeUnchangedConfidentialityHighIntegrityHighAvailabilityHigh,Low,None,Unchanged,High,High,High,CVSS:3.1/AV:L/AC:H/PR:L/UI:N/S:U/C:H/I:H/A:H,>=0.7.0,"Affected versions ofrusbdid not requireUsbContextto implementSendandSync. However, throughDeviceandDeviceHandleit is possible to useUsbContexts across threads. This issue allows non-thread safeUsbContexttypes to be used concurrently
leading to data races and memory corruption. The issue was fixed by addingSendandSyncbounds toUsbContext. Advisory available underCC0-1.0license."
HIGH,Double drop upon panic in 'fn map_array()',"January 10, 2021","January 18, 2021(last modified: June 13, 2023)",glsl-layout(crates.io),/packages/glsl-layout.html,Vulnerability,memory-corruption,"{'text': 'CVE-2021-25902', 'url': 'https://cve.mitre.org/cgi-bin/cvename.cgi?name=CVE-2021-25902'}, {'text': 'GHSA-cx4j-fxr7-jxg8', 'url': 'https://github.com/advisories/GHSA-cx4j-fxr7-jxg8'}","{'text': 'https://github.com/rustgd/glsl-layout/pull/10', 'url': 'https://github.com/rustgd/glsl-layout/pull/10'}",7.5HIGH,Network,LowPrivileges requiredNoneUser interactionNoneScopeUnchangedConfidentialityNoneIntegrityNoneAvailabilityHigh,None,None,Unchanged,None,None,High,Network,LowPrivileges requiredNoneUser interactionNoneScopeUnchangedConfidentialityNoneIntegrityNoneAvailabilityHigh,None,None,Unchanged,None,None,High,CVSS:3.1/AV:N/AC:L/PR:N/UI:N/S:U/C:N/I:N/A:H,>=0.4.0,"Affected versions of this crate did not guard against panic within the user-provided functionf(2nd parameter offn map_array), and thus panic withinfcauses double drop of a single object. The flaw was corrected in the 0.4.0 release by wrapping the object vulnerable
to a double drop withinManuallyDrop<T>. Advisory available underCC0-1.0license."
HIGH,Dangling reference inaccess::Mapwith Constant,"December 10, 2020","December 11, 2020(last modified: June 13, 2023)",arc-swap(crates.io),/packages/arc-swap.html,Vulnerability,memory-corruption,,"{'text': 'CVE-2020-35711', 'url': 'https://cve.mitre.org/cgi-bin/cvename.cgi?name=CVE-2020-35711'}, {'text': 'GHSA-9pqx-g3jh-qpqq', 'url': 'https://github.com/advisories/GHSA-9pqx-g3jh-qpqq'}","{'text': 'https://github.com/vorner/arc-swap/issues/45', 'url': 'https://github.com/vorner/arc-swap/issues/45'}",7.5HIGH,Network,LowPrivileges requiredNoneUser interactionNoneScopeUnchangedConfidentialityNoneIntegrityNoneAvailabilityHigh,None,None,Unchanged,None,None,High,Network,LowPrivileges requiredNoneUser interactionNoneScopeUnchangedConfidentialityNoneIntegrityNoneAvailabilityHigh,None,None,Unchanged,None,None,High,CVSS:3.1/AV:N/AC:L/PR:N/UI:N/S:U/C:N/I:N/A:H,">=0.4.8, <1.0.0-0>=1.1.0",<0.4.2,Version,<1.1.0,"Using thearc_swap::access::Mapwith theConstanttest helper (or with
user-provided implementation of theAccesstrait) could sometimes lead to the
map returning dangling references. Replaced by implementation withoutunsafe, at the cost of addedClonebound
on the closure and small penalty on performance. Advisory available underCC0-1.0license.",arc_swap;;access;;mapguard;;deref,<1.1.0
