classification,subtitle,reported,issued,package_name,package_url,type,keywords,aliases,references,patched,description,unaffected,References
MEDIUM,AtomicOption should have Send + Sync bound on its type argument.,"October 31, 2020","January 20, 2021(last modified: June 13, 2023)",atomic-option(crates.io),/packages/atomic-option.html,Vulnerability,"memory-corruption, thread-safety","{'text': 'CVE-2020-36219', 'url': 'https://cve.mitre.org/cgi-bin/cvename.cgi?name=CVE-2020-36219'}, {'text': 'GHSA-8gf5-q9p9-wvmc', 'url': 'https://github.com/advisories/GHSA-8gf5-q9p9-wvmc'}","{'text': 'https://github.com/reem/rust-atomic-option/issues/4', 'url': 'https://github.com/reem/rust-atomic-option/issues/4'}",5.9MEDIUM,Network,HighPrivileges requiredNoneUser interactionNoneScopeUnchangedConfidentialityNoneIntegrityNoneAvailabilityHigh,None,None,Unchanged,None,None,High,Network,HighPrivileges requiredNoneUser interactionNoneScopeUnchangedConfidentialityNoneIntegrityNoneAvailabilityHigh,None,None,Unchanged,None,None,High,CVSS:3.1/AV:N/AC:H/PR:N/UI:N/S:U/C:N/I:N/A:H,no patched versions,"In the affected versions of this crate,AtomicOption<T>unconditionally implementsSync. This allows programmers to move non-Sync types across thread boundaries (e.g.Rc<T>,Arc<Cell<T>>), which can lead to data races and undefined behavior.
It is also possible to send non-Send types likestd::sync::MutexGuardto other threads, which can lead to undefined behavior. Advisory available underCC0-1.0license."
MEDIUM,Soundness issue with base::Error,"December 10, 2020","January 18, 2021(last modified: June 13, 2023)",xcb(crates.io),/packages/xcb.html,INFOUnsound,"memory-corruption, thread-safety","{'text': 'CVE-2020-36205', 'url': 'https://cve.mitre.org/cgi-bin/cvename.cgi?name=CVE-2020-36205'}, {'text': 'GHSA-c8hq-x4mm-p6q6', 'url': 'https://github.com/advisories/GHSA-c8hq-x4mm-p6q6'}","{'text': 'https://github.com/rust-x-bindings/rust-xcb/issues/93', 'url': 'https://github.com/rust-x-bindings/rust-xcb/issues/93'}",5.5MEDIUM,Local,LowPrivileges requiredLowUser interactionNoneScopeUnchangedConfidentialityNoneIntegrityNoneAvailabilityHigh,Low,None,Unchanged,None,None,High,Local,LowPrivileges requiredLowUser interactionNoneScopeUnchangedConfidentialityNoneIntegrityNoneAvailabilityHigh,Low,None,Unchanged,None,None,High,CVSS:3.1/AV:L/AC:L/PR:L/UI:N/S:U/C:N/I:N/A:H,>=1.0,"base::Errortype contains public field namedptr.
With this definition, it is possible to create abase::Errorwith an invalid pointer and trigger memory safety errors
such as use-after-free or double-free with safe Rust. The users ofxcbcrate are advised not to manipulate the field. Advisory available underCC0-1.0license."
MEDIUM,TreeFocus lacks bounds on its Send and Sync traits,"November  9, 2020","January 18, 2021(last modified: June 13, 2023)",im(crates.io),/packages/im.html,INFOUnsound,thread-safety,"{'text': 'CVE-2020-36204', 'url': 'https://cve.mitre.org/cgi-bin/cvename.cgi?name=CVE-2020-36204'}, {'text': 'GHSA-q9h2-4xhf-23xx', 'url': 'https://github.com/advisories/GHSA-q9h2-4xhf-23xx'}","{'text': 'https://github.com/bodil/im-rs/issues/157', 'url': 'https://github.com/bodil/im-rs/issues/157'}",4.7MEDIUM,Local,HighPrivileges requiredLowUser interactionNoneScopeUnchangedConfidentialityNoneIntegrityNoneAvailabilityHigh,Low,None,Unchanged,None,None,High,Local,HighPrivileges requiredLowUser interactionNoneScopeUnchangedConfidentialityNoneIntegrityNoneAvailabilityHigh,Low,None,Unchanged,None,None,High,CVSS:3.1/AV:L/AC:H/PR:L/UI:N/S:U/C:N/I:N/A:H,>=15.1.0,<12.0.0,"Affected versions ofimcontainsTreeFocusthat unconditionally implementsSendandSync. This allows a data race in safe Rust code ifTreeFocusis extracted fromFocustype.
Typical users that only useFocustype are not affected. Advisory available underCC0-1.0license."
MEDIUM,Missing Send bound for Lazy,"January 17, 2021","January 18, 2021(last modified: June 13, 2023)",lazy-init(crates.io),/packages/lazy-init.html,Vulnerability,memory-corruption,"{'text': 'CVE-2021-25901', 'url': 'https://cve.mitre.org/cgi-bin/cvename.cgi?name=CVE-2021-25901'}, {'text': 'GHSA-w47j-hqpf-qw9w', 'url': 'https://github.com/advisories/GHSA-w47j-hqpf-qw9w'}","{'text': 'https://github.com/khuey/lazy-init/issues/9', 'url': 'https://github.com/khuey/lazy-init/issues/9'}",5.3MEDIUM,Network,LowPrivileges requiredNoneUser interactionNoneScopeUnchangedConfidentialityNoneIntegrityNoneAvailabilityLow,None,None,Unchanged,None,None,Low,Network,LowPrivileges requiredNoneUser interactionNoneScopeUnchangedConfidentialityNoneIntegrityNoneAvailabilityLow,None,None,Unchanged,None,None,Low,CVSS:3.1/AV:N/AC:L/PR:N/UI:N/S:U/C:N/I:N/A:L,>0.4.0,All current versions of this crate allow causing data races in safe code. The flaw will be fixed in the next release. Advisory available underCC0-1.0license.
MEDIUM,"Unsound: can makeARefsscontain a !Send, !Sync object.","December  1, 2020","January  6, 2021(last modified: June 13, 2023)",reffers(crates.io),/packages/reffers.html,INFOUnsound,"memory-corruption, thread-safety",,"{'text': 'CVE-2020-36203', 'url': 'https://cve.mitre.org/cgi-bin/cvename.cgi?name=CVE-2020-36203'}, {'text': 'GHSA-39xg-8p43-h76x', 'url': 'https://github.com/advisories/GHSA-39xg-8p43-h76x'}","{'text': 'https://github.com/diwic/reffers-rs/issues/7', 'url': 'https://github.com/diwic/reffers-rs/issues/7'}",4.7MEDIUM,Local,HighPrivileges requiredLowUser interactionNoneScopeUnchangedConfidentialityNoneIntegrityNoneAvailabilityHigh,Low,None,Unchanged,None,None,High,Local,HighPrivileges requiredLowUser interactionNoneScopeUnchangedConfidentialityNoneIntegrityNoneAvailabilityHigh,Low,None,Unchanged,None,None,High,CVSS:3.1/AV:L/AC:H/PR:L/UI:N/S:U/C:N/I:N/A:H,>=0.6.1,"ARefss<'a, V>is a type that is assumed to contain objects that areSend + Sync. In the affected versions of this crate,Send/Synctraits are unconditionally implemented forARefss<'a, V>. By using theARefss::map()API, we can insert a!Sendor!Syncobject intoARefss<'a, V>. After that, it is possible to create a data race to the inner object ofARefss<'a, V>, which can lead to undefined behavior & memory corruption. The flaw was corrected in commit 6dd7ca0 (https://github.com/diwic/reffers-rs/commit/6dd7ca0d50f2464df708975cdafcfaeeb6d41c66) by adding trait boundV: Send + SynctoARefss::map()API. Advisory available underCC0-1.0license."
MEDIUM,XSS in mdBook's search page,"January  4, 2021","January  4, 2021(last modified: October 19, 2021)",mdbook(crates.io),/packages/mdbook.html,Vulnerability,code-execution,,"{'text': 'CVE-2020-26297', 'url': 'https://cve.mitre.org/cgi-bin/cvename.cgi?name=CVE-2020-26297'}","{'text': 'https://groups.google.com/g/rustlang-security-announcements/c/3-sO6of29O0', 'url': 'https://groups.google.com/g/rustlang-security-announcements/c/3-sO6of29O0'}",6.1MEDIUM,Network,LowPrivileges requiredNoneUser interactionRequiredScopeChangedConfidentialityLowIntegrityLowAvailabilityNone,None,Required,Changed,Low,Low,None,Network,LowPrivileges requiredNoneUser interactionRequiredScopeChangedConfidentialityLowIntegrityLowAvailabilityNone,None,Required,Changed,Low,Low,None,CVSS:3.1/AV:N/AC:L/PR:N/UI:R/S:C/C:L/I:L/A:N,>=0.4.5,<=0.1.3,"The Rust Security Response Working Group was recently notified of a security
issue affecting the search feature of mdBook, which could allow an attacker to
execute arbitrary JavaScript code on the page. The CVE for this vulnerability isCVE-2020-26297. The search feature of mdBook (introduced in version 0.1.4) was affected by a
cross site scripting vulnerability that allowed an attacker to execute
arbitrary JavaScript code on an user's browser by tricking the user into typing
a malicious search query, or tricking the user into clicking a link to the
search page with the malicious search query prefilled. mdBook 0.4.5 fixes the vulnerability by properly escaping the search query. Owners of websites built with mdBook have to upgrade to mdBook 0.4.5 or greater
and rebuild their website contents with it. It's possible to install mdBook
0.4.5 on the local system with: Thanks to Kamil Vavra for responsibly disclosing the vulnerability to us
according toour security policy. All times are listed in UTC. Advisory available underCC0-1.0license."
MEDIUM,"Send/Sync bound needed on V inimpl Send/Sync for ARCache<K, V>","November 13, 2020","December 17, 2020(last modified: June 13, 2023)",concread(crates.io),/packages/concread.html,INFOUnsound,thread-safety,"{'text': 'CVE-2020-35928', 'url': 'https://cve.mitre.org/cgi-bin/cvename.cgi?name=CVE-2020-35928'}, {'text': 'GHSA-4xj5-vv9x-63jp', 'url': 'https://github.com/advisories/GHSA-4xj5-vv9x-63jp'}","{'text': 'https://github.com/kanidm/concread/issues/48', 'url': 'https://github.com/kanidm/concread/issues/48'}",4.7MEDIUM,Local,HighPrivileges requiredLowUser interactionNoneScopeUnchangedConfidentialityNoneIntegrityNoneAvailabilityHigh,Low,None,Unchanged,None,None,High,Local,HighPrivileges requiredLowUser interactionNoneScopeUnchangedConfidentialityNoneIntegrityNoneAvailabilityHigh,Low,None,Unchanged,None,None,High,CVSS:3.1/AV:L/AC:H/PR:L/UI:N/S:U/C:N/I:N/A:H,>=0.2.6,"Affected versions of this crate unconditionally implementedSend/Synctraits forARCache<K, V>type. This allows users to send/access types that do not implementSend/Sync, which can cause a data race. The flaw was corrected in the 0.2.6 release by adding boundsK: Send + Sync&V: Send + Syncto affectedSend/Synctrait implementations. Advisory available underCC0-1.0license."
MEDIUM,Thexallows data races of non-Send types across threads,"December  8, 2020","December  9, 2020(last modified: June 13, 2023)",thex(crates.io),/packages/thex.html,Vulnerability,"memory-corruption, thread-safety",,"{'text': 'CVE-2020-35927', 'url': 'https://cve.mitre.org/cgi-bin/cvename.cgi?name=CVE-2020-35927'}, {'text': 'GHSA-j42v-6wpm-r847', 'url': 'https://github.com/advisories/GHSA-j42v-6wpm-r847'}",5.5MEDIUM,Local,LowPrivileges requiredLowUser interactionNoneScopeUnchangedConfidentialityNoneIntegrityNoneAvailabilityHigh,Low,None,Unchanged,None,None,High,Local,LowPrivileges requiredLowUser interactionNoneScopeUnchangedConfidentialityNoneIntegrityNoneAvailabilityHigh,Low,None,Unchanged,None,None,High,CVSS:3.1/AV:L/AC:L/PR:L/UI:N/S:U/C:N/I:N/A:H,no patched versions,"thex::Thex<T>implementsSyncfor all typesT. However, it is missing a
bound forT: Send. This allows non-Send types such asRcto be sent across thread boundaries
which can trigger undefined behavior and memory corruption. Advisory available underCC0-1.0license."
MEDIUM,nanorand 0.5.0 - RNGs failed to generate properly for non-64-bit numbers,"December  9, 2020","December  9, 2020(last modified: June 13, 2023)",nanorand(crates.io),/packages/nanorand.html,Vulnerability,crypto-failure,,"{'text': 'CVE-2020-35926', 'url': 'https://cve.mitre.org/cgi-bin/cvename.cgi?name=CVE-2020-35926'}, {'text': 'GHSA-m9m5-cg5h-r582', 'url': 'https://github.com/advisories/GHSA-m9m5-cg5h-r582'}","{'text': 'https://twitter.com/aspenluxxxy/status/1336684692284772352', 'url': 'https://twitter.com/aspenluxxxy/status/1336684692284772352'}",5.1MEDIUM,Local,LowPrivileges requiredNoneUser interactionNoneScopeUnchangedConfidentialityLowIntegrityLowAvailabilityNone,None,None,Unchanged,Low,Low,None,Local,LowPrivileges requiredNoneUser interactionNoneScopeUnchangedConfidentialityLowIntegrityLowAvailabilityNone,None,None,Unchanged,Low,Low,None,CVSS:3.1/AV:L/AC:L/PR:N/UI:N/S:U/C:L/I:L/A:N,>=0.5.1,"In versions ofnanorandprior to 0.5.1,RandomGenimplementations for standard unsigned integers could
fail to properly generate numbers, due to using bit-shifting to truncate a 64-bit number, rather than just
anasconversion. This often manifested as RNGs returning nothing but 0, including the cryptographically secureChaCharandom
number generator.. Advisory available underCC0-1.0license."
MEDIUM,MPMCConsumer/Producer allows sending non-Send type across threads,"November 29, 2020","December  7, 2020(last modified: June 13, 2023)",magnetic(crates.io),/packages/magnetic.html,Vulnerability,thread-safety,"{'text': 'CVE-2020-35925', 'url': 'https://cve.mitre.org/cgi-bin/cvename.cgi?name=CVE-2020-35925'}, {'text': 'GHSA-wv4p-jp67-jr97', 'url': 'https://github.com/advisories/GHSA-wv4p-jp67-jr97'}","{'text': 'https://github.com/johnshaw/magnetic/issues/9', 'url': 'https://github.com/johnshaw/magnetic/issues/9'}",5.5MEDIUM,Local,LowPrivileges requiredLowUser interactionNoneScopeUnchangedConfidentialityNoneIntegrityNoneAvailabilityHigh,Low,None,Unchanged,None,None,High,Local,LowPrivileges requiredLowUser interactionNoneScopeUnchangedConfidentialityNoneIntegrityNoneAvailabilityHigh,Low,None,Unchanged,None,None,High,CVSS:3.1/AV:L/AC:L/PR:L/UI:N/S:U/C:N/I:N/A:H,>=2.0.1,"Affected versions of this crate unconditionally implementedSyncandSendtraits forMPMCConsumerandMPMCProducertypes. This allows users to send types that do not implementSendtrait across thread boundaries, which can cause a data race. The flaw was corrected in the 2.0.1 release by addingT: Sendbound to affected Sync/Send trait implementations. Advisory available underCC0-1.0license."
MEDIUM,TryMutexallows sending non-Send type across threads,"November 17, 2020","December  7, 2020(last modified: June 13, 2023)",try-mutex(crates.io),/packages/try-mutex.html,Vulnerability,thread-safety,"{'text': 'CVE-2020-35924', 'url': 'https://cve.mitre.org/cgi-bin/cvename.cgi?name=CVE-2020-35924'}, {'text': 'GHSA-64j8-7gp2-xjx5', 'url': 'https://github.com/advisories/GHSA-64j8-7gp2-xjx5'}","{'text': 'https://github.com/mpdn/try-mutex/issues/2', 'url': 'https://github.com/mpdn/try-mutex/issues/2'}",5.5MEDIUM,Local,LowPrivileges requiredLowUser interactionNoneScopeUnchangedConfidentialityNoneIntegrityNoneAvailabilityHigh,Low,None,Unchanged,None,None,High,Local,LowPrivileges requiredLowUser interactionNoneScopeUnchangedConfidentialityNoneIntegrityNoneAvailabilityHigh,Low,None,Unchanged,None,None,High,CVSS:3.1/AV:L/AC:L/PR:L/UI:N/S:U/C:N/I:N/A:H,>=0.3.0,"Affected versions of this crate unconditionally implemented Sync trait forTryMutex<T>type. This allows users to put non-SendTtype inTryMutexand send it to another thread, which can cause a data race. The flaw was corrected in the 0.3.0 release by addingT: Sendbound for the Sync trait implementation. Advisory available underCC0-1.0license."
MEDIUM,ordered_float:NotNan may contain NaN after panic in assignment operators,"December  6, 2020","December  6, 2020(last modified: June 13, 2023)",ordered-float(crates.io),/packages/ordered-float.html,Vulnerability,,"{'text': 'CVE-2020-35923', 'url': 'https://cve.mitre.org/cgi-bin/cvename.cgi?name=CVE-2020-35923'}, {'text': 'GHSA-566x-hhrf-qf8m', 'url': 'https://github.com/advisories/GHSA-566x-hhrf-qf8m'}","{'text': 'https://github.com/reem/rust-ordered-float/pull/71', 'url': 'https://github.com/reem/rust-ordered-float/pull/71'}",5.5MEDIUM,Local,LowPrivileges requiredLowUser interactionNoneScopeUnchangedConfidentialityNoneIntegrityNoneAvailabilityHigh,Low,None,Unchanged,None,None,High,Local,LowPrivileges requiredLowUser interactionNoneScopeUnchangedConfidentialityNoneIntegrityNoneAvailabilityHigh,Low,None,Unchanged,None,None,High,CVSS:3.1/AV:L/AC:L/PR:L/UI:N/S:U/C:N/I:N/A:H,^1.1.1>=2.0.1,<0.2.2,"After using an assignment operators such asNotNan::add_assign,NotNan::mul_assign, etc., it was possible for the resultingNotNanvalue to contain aNaN.  This could cause undefined behavior in safe code, because the safeNotNan::cmpmethod contains internal unsafe code that assumes the value is neverNaN.  (It could also cause undefined behavior in third-party unsafe code that makes the same assumption, as well as logic errors in safe code.) This was mitigated starting in version 0.4.0, by panicking if the assigned value is NaN.  However, in affected versions from 0.4.0 onward, code that uses theNotNanvalue during unwinding, or that continues after catching the panic, could still observe the invalid value and trigger undefined behavior. The flaw is fully corrected in versions 1.1.1 and 2.0.1, by ensuring that the assignment operators panic without modifying the operand, if the result would beNaN. Advisory available underCC0-1.0license."
MEDIUM,net2invalidly assumes the memory layout of std::net::SocketAddr,"November  7, 2020","December  2, 2020(last modified: July  8, 2023)",net2(crates.io),/packages/net2.html,INFOUnsound,,"{'text': 'CVE-2020-35919', 'url': 'https://cve.mitre.org/cgi-bin/cvename.cgi?name=CVE-2020-35919'}, {'text': 'CVE-2020-35920', 'url': 'https://cve.mitre.org/cgi-bin/cvename.cgi?name=CVE-2020-35920'}, {'text': 'GHSA-458v-4hrf-g3m4', 'url': 'https://github.com/advisories/GHSA-458v-4hrf-g3m4'}, {'text': 'GHSA-c79c-gwph-gqfm', 'url': 'https://github.com/advisories/GHSA-c79c-gwph-gqfm'}","{'text': 'https://github.com/deprecrated/net2-rs/issues/105', 'url': 'https://github.com/deprecrated/net2-rs/issues/105'}",5.5MEDIUM,Local,LowPrivileges requiredLowUser interactionNoneScopeUnchangedConfidentialityNoneIntegrityNoneAvailabilityHigh,Low,None,Unchanged,None,None,High,Local,LowPrivileges requiredLowUser interactionNoneScopeUnchangedConfidentialityNoneIntegrityNoneAvailabilityHigh,Low,None,Unchanged,None,None,High,CVSS:3.1/AV:L/AC:L/PR:L/UI:N/S:U/C:N/I:N/A:H,>=0.2.36,"Thenet2crate has assumedstd::net::SocketAddrV4andstd::net::SocketAddrV6have the same memory layout as the system C representationsockaddr. It has simply casted the pointers to convert the socket addresses to the
system representation. The standard library does not say anything about the memory
layout, and this will cause invalid memory access if the standard library
changes the implementation. No warnings or errors will be emitted once the
change happens. Advisory available underCC0-1.0license."
MEDIUM,mioinvalidly assumes the memory layout of std::net::SocketAddr,"November  2, 2020","December  2, 2020(last modified: June 13, 2023)",mio(crates.io),/packages/mio.html,INFOUnsound,,"{'text': 'CVE-2020-35922', 'url': 'https://cve.mitre.org/cgi-bin/cvename.cgi?name=CVE-2020-35922'}, {'text': 'GHSA-pf3p-x6qj-6j7q', 'url': 'https://github.com/advisories/GHSA-pf3p-x6qj-6j7q'}","{'text': 'https://github.com/tokio-rs/mio/issues/1386', 'url': 'https://github.com/tokio-rs/mio/issues/1386'}",5.5MEDIUM,Local,LowPrivileges requiredLowUser interactionNoneScopeUnchangedConfidentialityNoneIntegrityNoneAvailabilityHigh,Low,None,Unchanged,None,None,High,Local,LowPrivileges requiredLowUser interactionNoneScopeUnchangedConfidentialityNoneIntegrityNoneAvailabilityHigh,Low,None,Unchanged,None,None,High,CVSS:3.1/AV:L/AC:L/PR:L/UI:N/S:U/C:N/I:N/A:H,>=0.7.6,<0.7.0,"Themiocrate has assumedstd::net::SocketAddrV4andstd::net::SocketAddrV6have the same memory layout as the system C representationsockaddr. It has simply casted the pointers to convert the socket addresses to the
system representation. The standard library does not say anything about the memory
layout, and this will cause invalid memory access if the standard library
changes the implementation. No warnings or errors will be emitted once the
change happens. Advisory available underCC0-1.0license."
MEDIUM,socket2invalidly assumes the memory layout of std::net::SocketAddr,"November  6, 2020","December  2, 2020(last modified: June 13, 2023)",socket2(crates.io),/packages/socket2.html,INFOUnsound,,"{'text': 'CVE-2020-35920', 'url': 'https://cve.mitre.org/cgi-bin/cvename.cgi?name=CVE-2020-35920'}, {'text': 'GHSA-458v-4hrf-g3m4', 'url': 'https://github.com/advisories/GHSA-458v-4hrf-g3m4'}","{'text': 'https://github.com/rust-lang/socket2-rs/issues/119', 'url': 'https://github.com/rust-lang/socket2-rs/issues/119'}",5.5MEDIUM,Local,LowPrivileges requiredLowUser interactionNoneScopeUnchangedConfidentialityNoneIntegrityNoneAvailabilityHigh,Low,None,Unchanged,None,None,High,Local,LowPrivileges requiredLowUser interactionNoneScopeUnchangedConfidentialityNoneIntegrityNoneAvailabilityHigh,Low,None,Unchanged,None,None,High,CVSS:3.1/AV:L/AC:L/PR:L/UI:N/S:U/C:N/I:N/A:H,>=0.3.16,"Thesocket2crate has assumedstd::net::SocketAddrV4andstd::net::SocketAddrV6have the same memory layout as the system C representationsockaddr. It has simply casted the pointers to convert the socket addresses to the
system representation. The standard library does not say anything about the memory
layout, and this will cause invalid memory access if the standard library
changes the implementation. No warnings or errors will be emitted once the
change happens. Advisory available underCC0-1.0license."
MEDIUM,miowinvalidly assumes the memory layout of std::net::SocketAddr,"November 13, 2020","December  2, 2020(last modified: June 13, 2023)",miow(crates.io),/packages/miow.html,INFOUnsound,,"{'text': 'CVE-2020-35921', 'url': 'https://cve.mitre.org/cgi-bin/cvename.cgi?name=CVE-2020-35921'}, {'text': 'GHSA-jrcf-4jp8-m28v', 'url': 'https://github.com/advisories/GHSA-jrcf-4jp8-m28v'}","{'text': 'https://github.com/yoshuawuyts/miow/issues/38', 'url': 'https://github.com/yoshuawuyts/miow/issues/38'}",5.5MEDIUM,Local,LowPrivileges requiredLowUser interactionNoneScopeUnchangedConfidentialityNoneIntegrityNoneAvailabilityHigh,Low,None,Unchanged,None,None,High,Local,LowPrivileges requiredLowUser interactionNoneScopeUnchangedConfidentialityNoneIntegrityNoneAvailabilityHigh,Low,None,Unchanged,None,None,High,CVSS:3.1/AV:L/AC:L/PR:L/UI:N/S:U/C:N/I:N/A:H,^0.2.2>=0.3.6,"Themiowcrate has assumedstd::net::SocketAddrV4andstd::net::SocketAddrV6have the same memory layout as the system C representationsockaddr. It has simply casted the pointers to convert the socket addresses to the
system representation. The standard library does not say anything about the memory
layout, and this will cause invalid memory access if the standard library
changes the implementation. No warnings or errors will be emitted once the
change happens. Advisory available underCC0-1.0license."
MEDIUM,Unexpected panic when decoding tokens,"November 29, 2020","November 29, 2020(last modified: June 13, 2023)",branca(crates.io),/packages/branca.html,Vulnerability,denial-of-service,,"{'text': 'CVE-2020-35918', 'url': 'https://cve.mitre.org/cgi-bin/cvename.cgi?name=CVE-2020-35918'}, {'text': 'GHSA-c9rv-3jmq-527w', 'url': 'https://github.com/advisories/GHSA-c9rv-3jmq-527w'}","{'text': 'https://github.com/return/branca/issues/24', 'url': 'https://github.com/return/branca/issues/24'}",5.5MEDIUM,Local,LowPrivileges requiredLowUser interactionNoneScopeUnchangedConfidentialityNoneIntegrityNoneAvailabilityHigh,Low,None,Unchanged,None,None,High,Local,LowPrivileges requiredLowUser interactionNoneScopeUnchangedConfidentialityNoneIntegrityNoneAvailabilityHigh,Low,None,Unchanged,None,None,High,CVSS:3.1/AV:L/AC:L/PR:L/UI:N/S:U/C:N/I:N/A:H,>=0.10.0,Version,<0.10.0,<0.10.0,"Prior to0.10.0it was possible to have both decoding functions panic unexpectedly,
by supplying tokens with an incorrect base62 encoding. The documentation stated that an error should have been reported instead. Advisory available underCC0-1.0license.",branca;;branca;;decode,<0.10.0
MEDIUM,Reference counting error inFrom<Py<T>>,"November 28, 2020","November 28, 2020(last modified: June 13, 2023)",pyo3(crates.io),/packages/pyo3.html,Vulnerability,,"{'text': 'CVE-2020-35917', 'url': 'https://cve.mitre.org/cgi-bin/cvename.cgi?name=CVE-2020-35917'}, {'text': 'GHSA-2vx6-fcw6-hpr6', 'url': 'https://github.com/advisories/GHSA-2vx6-fcw6-hpr6'}","{'text': 'https://github.com/PyO3/pyo3/pull/1297', 'url': 'https://github.com/PyO3/pyo3/pull/1297'}",5.5MEDIUM,Local,LowPrivileges requiredLowUser interactionNoneScopeUnchangedConfidentialityNoneIntegrityNoneAvailabilityHigh,Low,None,Unchanged,None,None,High,Local,LowPrivileges requiredLowUser interactionNoneScopeUnchangedConfidentialityNoneIntegrityNoneAvailabilityHigh,Low,None,Unchanged,None,None,High,CVSS:3.1/AV:L/AC:L/PR:L/UI:N/S:U/C:N/I:N/A:H,>=0.12.4,<0.12.0,"A bug inFrom<Py<T>>would lead to an extra reference count decrement, often
leading to use-after-free issues. Advisory available underCC0-1.0license."
MEDIUM,Mutable reference with immutable provenance,"November 12, 2020","November 20, 2020(last modified: June 13, 2023)",image(crates.io),/packages/image.html,INFOUnsound,,"{'text': 'CVE-2020-35916', 'url': 'https://cve.mitre.org/cgi-bin/cvename.cgi?name=CVE-2020-35916'}, {'text': 'GHSA-9wgh-vjj7-7433', 'url': 'https://github.com/advisories/GHSA-9wgh-vjj7-7433'}","{'text': 'https://github.com/image-rs/image/issues/1357', 'url': 'https://github.com/image-rs/image/issues/1357'}",5.5MEDIUM,Local,LowPrivileges requiredLowUser interactionNoneScopeUnchangedConfidentialityNoneIntegrityNoneAvailabilityHigh,Low,None,Unchanged,None,None,High,Local,LowPrivileges requiredLowUser interactionNoneScopeUnchangedConfidentialityNoneIntegrityNoneAvailabilityHigh,Low,None,Unchanged,None,None,High,CVSS:3.1/AV:L/AC:L/PR:L/UI:N/S:U/C:N/I:N/A:H,>=0.23.12,Version,<0.23.12,<0.23.12,<0.23.12,<0.23.12,<0.23.12,<0.23.12,"A mutable reference to a struct was constructed by dereferencing a pointer
obtained fromslice::as_ptr. Instead,slice::as_mut_ptrshould have been
called on the mutable slice argument. The former performs an implicit reborrow
as an immutable shared reference which does not allow writing through the
derived pointer. There is no evidence for miscompilation, exploitable or otherwise, caused by
this bug.Further investigation on Zulipsuggests that the unoptimized
generated LLVM IR does not contain any UB itself, effectively mitigating
further effects. Advisory available underCC0-1.0license.",image;;bgr;;from_slice_mut,<0.23.12
