classification,subtitle,reported,issued,package_name,package_url,type,keywords,aliases,references,patched,description,unaffected,References
NA,Improper Neutralization of CRLF Sequences in HTTP Headers ('HTTP Request/Response Splitting'),"January 23, 2024","January 24, 2024",trillium-client(crates.io),/packages/trillium-client.html,Vulnerability,,"{'text': 'GHSA-9f9p-cp3c-72jf', 'url': 'https://github.com/advisories/GHSA-9f9p-cp3c-72jf'}, {'text': 'CVE-2024-23644', 'url': 'https://cve.mitre.org/cgi-bin/cvename.cgi?name=CVE-2024-23644'}","{'text': 'https://github.com/trillium-rs/trillium/security/advisories/GHSA-9f9p-cp3c-72jf', 'url': 'https://github.com/trillium-rs/trillium/security/advisories/GHSA-9f9p-cp3c-72jf'}",>=0.5.4,,Insufficient validation of outbound header values may lead to request splitting or response splitting attacks in scenarios where attackers have sufficient control over outbound headers.,"Discovered and reported by@divergentdave, {'text': '@divergentdave', 'url': 'https://github.com/divergentdave'}, Advisory available underCC0-1.0license., {'text': 'CC0-1.0', 'url': 'https://spdx.org/licenses/CC0-1.0.html'}"
NA,Improper Neutralization of CRLF Sequences in HTTP Headers ('HTTP Request/Response Splitting'),"January 23, 2024","January 24, 2024",trillium-http(crates.io),/packages/trillium-http.html,Vulnerability,,"{'text': 'GHSA-9f9p-cp3c-72jf', 'url': 'https://github.com/advisories/GHSA-9f9p-cp3c-72jf'}, {'text': 'CVE-2024-23644', 'url': 'https://cve.mitre.org/cgi-bin/cvename.cgi?name=CVE-2024-23644'}","{'text': 'https://github.com/trillium-rs/trillium/security/advisories/GHSA-9f9p-cp3c-72jf', 'url': 'https://github.com/trillium-rs/trillium/security/advisories/GHSA-9f9p-cp3c-72jf'}",>=0.3.12,,Insufficient validation of outbound header values may lead to request splitting or response splitting attacks in scenarios where attackers have sufficient control over outbound headers.,"Discovered and reported by@divergentdave, {'text': '@divergentdave', 'url': 'https://github.com/divergentdave'}, Advisory available underCC0-1.0license., {'text': 'CC0-1.0', 'url': 'https://spdx.org/licenses/CC0-1.0.html'}"
NA,Multiple issues involving quote API,"January 21, 2024","January 22, 2024",shlex(crates.io),/packages/shlex.html,Vulnerability,"code-execution, file-disclosure","{'text': 'GHSA-r7qv-8r2h-pg27', 'url': 'https://github.com/advisories/GHSA-r7qv-8r2h-pg27'}","{'text': 'https://github.com/comex/rust-shlex/security/advisories/GHSA-r7qv-8r2h-pg27', 'url': 'https://github.com/comex/rust-shlex/security/advisories/GHSA-r7qv-8r2h-pg27'}",>=1.3.0,Version,<1.2.1,<1.2.1,<1.2.1,<1.2.1,"Affected versions of this crate allowed the bytes{and\xa0to appear
unquoted and unescaped in command arguments. If the output ofquoteorjoinis passed to a shell, then what should be a
single command argument could be interpreted as multiple arguments. This does notdirectlyallow arbitrary command execution (you can't inject a
command substitution or similar).  But depending on the command you're running,
being able to inject multiple arguments where only one is expected could lead
to undesired consequences, potentially including arbitrary command execution. The flaw was corrected in version 1.2.1 by escaping additional characters.
Updating to 1.3.0 is recommended, but 1.2.1 offers a more minimal fix if
desired. Workaround: Check for the bytes{and\xa0inquote/joininput or
output. (Note:{is problematic because it is used for glob expansion.\xa0is
problematic because it's treated as a word separator inspecific
environments.) Version 1.3.0 deprecates thequoteandjoinAPIs in favor oftry_quoteandtry_join, which behave the same except that they haveResultreturn
type, returningErrif the input contains nul bytes. Strings containing nul bytes generally cannot be used in Unix command arguments
or environment variables, and most shells cannot handle nul bytes even
internally.  If you try to pass one anyway, then the results might be
security-sensitive in uncommon scenarios.More details here. Due to the low severity, the behavior of the originalquoteandjoinAPIs
has not changed; they continue to allow nuls. Workaround: Manually check for nul bytes inquote/joininput or output. Thequotefamily of functions does not and cannot escape control characters.
With non-interactive shells this is perfectly safe, as control characters have
no special effect.  But if you writing directly to the standard input of an
interactive shell (or through a pty), then control characterscan cause
misbehavior including arbitrary command injection. This is essentially unfixable, and has not been patched.  But as of version
1.3.0, documentation has been added. Future versions ofshlexmay add API variants that avoid the issue at the
cost of reduced portability. Advisory available underCC0-1.0license.",shlex;;bytes;;join,<1.2.1
NA,Resource exhaustion vulnerability in h2 may lead to Denial of Service (DoS),"January 17, 2024","January 17, 2024",h2(crates.io),/packages/h2.html,Vulnerability,denial-of-service,,"{'text': 'https://github.com/Netflix/security-bulletins/blob/master/advisories/third-party/2019-002.md', 'url': 'https://github.com/Netflix/security-bulletins/blob/master/advisories/third-party/2019-002.md'}",CVE-2019-9514,^0.3.24>=0.4.2,"An attacker with an HTTP/2 connection to an affected endpoint can send a steady stream of invalid frames to force the
generation of reset frames on the victim endpoint.
By closing their recv window, the attacker could then force these resets to be queued in an unbounded fashion,
resulting in Out Of Memory (OOM) and high CPU usage. This fix is corrected inhyperium/h2#737, which limits the total number of
internal error resets emitted by default before the connection is closed. Advisory available underCC0-1.0license."
NA,Remotely exploitable DoS condition in Rosenpass <=0.2.0,"November  4, 2023","December 21, 2023",rosenpass(crates.io),/packages/rosenpass.html,Vulnerability,denial-of-service,,"{'text': 'https://github.com/rosenpass/rosenpass/commit/93439858d1c44294a7b377f775c4fc897a370bb2', 'url': 'https://github.com/rosenpass/rosenpass/commit/93439858d1c44294a7b377f775c4fc897a370bb2'}",>=0.2.1,Affected version do this crate did not validate the size of buffers when attempting to decode messages. This allows an attacker to trigger a panic by sending a UDP datagram with a 1 byte payload over network. This flaw was corrected by validating the size of the buffers before attempting to decode the message. Advisory available underCC0-1.0license.
NA,Some Ref methods are unsound with some type parameters,"December 14, 2023","December 18, 2023",zerocopy(crates.io),/packages/zerocopy.html,Vulnerability,,"{'text': 'https://github.com/google/zerocopy/issues/716', 'url': 'https://github.com/google/zerocopy/issues/716'}",">=0.2.9, <0.3.0>=0.3.2, <0.4.0>=0.4.1, <0.5.0>=0.5.2, <0.6.0>=0.6.6, <0.7.0>=0.7.31",<0.2.2,Version,">=0.2.2, <0.2.9>=0.3.0, <0.3.2>=0.4.0, <0.4.1>=0.5.0, <0.5.2>=0.6.0, <0.6.6>=0.7.0, <0.7.31",">=0.2.2, <0.2.9>=0.3.0, <0.3.2>=0.4.0, <0.4.1>=0.5.0, <0.5.2>=0.6.0, <0.6.6>=0.7.0, <0.7.31",">=0.2.2, <0.2.9>=0.3.0, <0.3.2>=0.4.0, <0.4.1>=0.5.0, <0.5.2>=0.6.0, <0.6.6>=0.7.0, <0.7.31",">=0.2.2, <0.2.9>=0.3.0, <0.3.2>=0.4.0, <0.4.1>=0.5.0, <0.5.2>=0.6.0, <0.6.6>=0.7.0, <0.7.31","TheRefmethodsinto_ref,into_mut,into_slice, andinto_slice_mutare unsound
and may allow safe code to exhibit undefined behavior when used withRef<B, T>whereBiscell::Reforcell::RefMut. Note that these
methods remain sound when used withBtypes other thancell::Reforcell::RefMut. See https://github.com/google/zerocopy/issues/716 for a more in-depth analysis. The current plan is to yank the affected versions soon. See
https://github.com/google/zerocopy/issues/679 for more detail. Advisory available underCC0-1.0license.",zerocopy;;ref;;into_mut,">=0.2.2, <0.2.9>=0.3.0, <0.3.2>=0.4.0, <0.4.1>=0.5.0, <0.5.2>=0.6.0, <0.6.6>=0.7.0, <0.7.31"
NA,Insufficient covariance check makes self_cell unsound,"November 10, 2023","November 11, 2023",self_cell(crates.io),/packages/self_cell.html,Vulnerability,,"{'text': 'https://github.com/Voultapher/self_cell/issues/49', 'url': 'https://github.com/Voultapher/self_cell/issues/49'}",">=0.10.3, <1.0.0>=1.0.2","All public versions prior to1.02used an insufficient check to ensure that
users correctly marked the dependent type as eithercovariantornot_covariant. This allowed users to mark a dependent as covariant even though
its type was not covariant but invariant, for certain invariant types involving
trait object lifetimes. One example for such a dependent type istype Dependent<'a> = RefCell<Box<dyn fmt::Display + 'a>>. Such a type allowed
unsound usage in purely safe user code that leads to undefined behavior. The
patched versions now produce a compile time error if such a type is marked ascovariant. Advisory available underCC0-1.0license."
NA,gix-transport code execution vulnerability,"September 23, 2023","September 25, 2023",gix-transport(crates.io),/packages/gix-transport.html,Vulnerability,code-execution,"{'text': 'https://github.com/Byron/gitoxide/pull/1032', 'url': 'https://github.com/Byron/gitoxide/pull/1032'}, {'text': 'https://secure.phabricator.com/T12961', 'url': 'https://secure.phabricator.com/T12961'}",>=0.36.1,"Thegix-transportcrate prior to the patched version 0.36.1 would allow attackers to
use malicious ssh clone URLs to pass arbitrary arguments to thesshprogram, leading
to arbitrary code execution. PoC:gix clone 'ssh://-oProxyCommand=open$IFS-aCalculator/foo' This will launch a calculator on OSX. See https://secure.phabricator.com/T12961 for more details on similar vulnerabilities ingit. Thanks forvin01for disclosing the issue. Advisory available underCC0-1.0license."
NA,libwebp: OOB write in BuildHuffmanTable,"September 12, 2023","September 13, 2023(last modified: September 26, 2023)",libwebp-sys(crates.io),/packages/libwebp-sys.html,Vulnerability,memory-corruption,,"{'text': 'CVE-2023-5129', 'url': 'https://cve.mitre.org/cgi-bin/cvename.cgi?name=CVE-2023-5129'}, {'text': 'CVE-2023-4863', 'url': 'https://cve.mitre.org/cgi-bin/cvename.cgi?name=CVE-2023-4863'}",>=0.9.3,"GoogleandMozillahave released security advisories for RCE due to heap overflow in libwebp. Google warns the vulnerability has been exploited in the wild. libwebp needs to be updated to 1.3.2 to include a patch for ""OOB write in BuildHuffmanTable"". Advisory available underCC0-1.0license."
NA,libwebp: OOB write in BuildHuffmanTable,"September 12, 2023","September 13, 2023(last modified: September 26, 2023)",libwebp-sys2(crates.io),/packages/libwebp-sys2.html,Vulnerability,memory-corruption,,"{'text': 'CVE-2023-5129', 'url': 'https://cve.mitre.org/cgi-bin/cvename.cgi?name=CVE-2023-5129'}, {'text': 'CVE-2023-4863', 'url': 'https://cve.mitre.org/cgi-bin/cvename.cgi?name=CVE-2023-4863'}",>=0.1.8,"GoogleandMozillahave released security advisories for RCE due to heap overflow in libwebp. Google warns the vulnerability has been exploited in the wild. libwebp needs to be updated to 1.3.2 to include a patch for ""OOB write in BuildHuffmanTable"". Advisory available underCC0-1.0license."
NA,Use-after-free invec_insert_bytes,"August  7, 2023","August 24, 2023(last modified: August 27, 2023)",mail-internals(crates.io),/packages/mail-internals.html,Vulnerability,memory-corruption,,"{'text': 'GHSA-rcx8-48pc-v9q8', 'url': 'https://github.com/advisories/GHSA-rcx8-48pc-v9q8'}","{'text': 'https://git.sr.ht/~nabijaczleweli/mail-internals.crate/commit/05443c864b204e7f1512caf2d53e8cce4dd340fc', 'url': 'https://git.sr.ht/~nabijaczleweli/mail-internals.crate/commit/05443c864b204e7f1512caf2d53e8cce4dd340fc'}",no patched versions,Version,>=0.2.0,"Incorrect reallocation logic in the functionvec_insert_bytescauses a use-after-free. This function does not have to be called directly to trigger the vulnerability because many methods onEncodingWritercall this function internally. The mail-* suite is unmaintained and the upstream sources have been actively vandalised.
A fixedmail-internals-ng(andmail-headers-ngandmail-core-ng) crate has been published which fixes this, and a dependency on another unsound crate. Advisory available underCC0-1.0license.",mail_internals;;utils;;vec_insert_bytes,>=0.2.0
NA,Double Public Key Signing Function Oracle Attack oned25519-dalek,"June 11, 2022","August 14, 2023(last modified: August 27, 2023)",ed25519-dalek(crates.io),/packages/ed25519-dalek.html,Vulnerability,crypto-failure,"{'text': 'GHSA-w5vr-6qhr-36cc', 'url': 'https://github.com/advisories/GHSA-w5vr-6qhr-36cc'}","{'text': 'https://github.com/MystenLabs/ed25519-unsafe-libs', 'url': 'https://github.com/MystenLabs/ed25519-unsafe-libs'}",>=2,"Versions ofed25519-dalekprior to v2.0 model private and public keys as
separate types which can be assembled into aKeypair, and also provide APIs
for serializing and deserializing 64-byte private/public keypairs. Such APIs and serializations are inherently unsafe as the public key is one of
the inputs used in the deterministic computation of theSpart of the signature,
but not in theRvalue. An adversary could somehow use the signing function as
an oracle that allows arbitrary public keys as input can obtain two signatures
for the same message sharing the sameRand only differ on theSpart. Unfortunately, when this happens, one can easily extract the private key. Revised public APIs in v2.0 ofed25519-dalekdo NOT allow a decoupled
private/public keypair as signing input, except as part of specially labeled
""hazmat"" APIs which are clearly labeled as being dangerous if misused. Advisory available underCC0-1.0license."
NA,opensslX509VerifyParamRef::set_hostbuffer over-read,"June 20, 2023","June 20, 2023(last modified: July  8, 2023)",openssl(crates.io),/packages/openssl.html,Vulnerability,memory-exposure,"{'text': 'GHSA-xcf7-rvmh-g6q4', 'url': 'https://github.com/advisories/GHSA-xcf7-rvmh-g6q4'}","{'text': 'https://github.com/sfackler/rust-openssl/issues/1965', 'url': 'https://github.com/sfackler/rust-openssl/issues/1965'}",>=0.10.55,Version,"<0.10.55, >=0.10.0","When this function was passed an empty string,opensslwould attempt to callstrlenon it, reading arbitrary memory until it reached a NUL byte. Advisory available underCC0-1.0license.",openssl;;x509;;verify;;x509verifyparamref;;set_host,"<0.10.55, >=0.10.0"
NA,Remote Attackers can cause Denial-of-Service (packet loops) with crafted DNS packets,"June  1, 2023","June  3, 2023(last modified: June 13, 2023)",trust-dns-server(crates.io),/packages/trust-dns-server.html,Vulnerability,denial-of-service,,"{'text': 'GHSA-5fm9-h728-fwpj', 'url': 'https://github.com/advisories/GHSA-5fm9-h728-fwpj'}","{'text': 'https://github.com/bluejekyll/trust-dns/pull/1952', 'url': 'https://github.com/bluejekyll/trust-dns/pull/1952'}",^0.22.1>=0.23.0-alpha.3,"trust-dns and trust-dns-server are vulnerable to remotely triggered denial-of-service attacks, consuming both network and CPU resources.
DNS messages with the QR=1 bit set are responded to with aFormErrresponse.
This allows creating a traffic loop, in which theseFormErrresponses are sent nonstop between vulnerable servers. There are two scenarios how this can be exploited: 1) Create a loop between two instances of trust-dns, consuming network resources, or 2) consuming the CPU of a single instance. With two instancesAandBan attacker sends a DNS query with a spoofed source IP address toA.Areplies with aFormErrtoB.
Now both servers with ping-pong the message back and forth until by chance the packet is dropped in the network.
Multiple spoofed packets can be sent by the attacker, increasing resource consumption. A single server can get locked up replying to itself.
Same setup as above, but nowAsends the reply to itself.
The packet is sent out as fast as the CPU and network stack manage.
This locks up a CPU core.
Multiple packets from the attacker consume multiple CPU cores. Advisory available underCC0-1.0license."
NA,Out-of-bounds array access leads to panic,"May 16, 2023","May 31, 2023(last modified: June 13, 2023)",buffered-reader(crates.io),/packages/buffered-reader.html,Vulnerability,denial-of-service,,"{'text': 'GHSA-29mf-62xx-28jq', 'url': 'https://github.com/advisories/GHSA-29mf-62xx-28jq'}","{'text': 'https://lists.sequoia-pgp.org/hyperkitty/list/announce@lists.sequoia-pgp.org/thread/SN2E3QRT4DMQ5JNEK6VIN6DJ5SH766DI/', 'url': 'https://lists.sequoia-pgp.org/hyperkitty/list/announce@lists.sequoia-pgp.org/thread/SN2E3QRT4DMQ5JNEK6VIN6DJ5SH766DI/'}, {'text': 'https://gitlab.com/sequoia-pgp/sequoia/-/tags/buffered-reader%2Fv1.2.0', 'url': 'https://gitlab.com/sequoia-pgp/sequoia/-/tags/buffered-reader%2Fv1.2.0'}",">=1.0.2, <1.1.0>=1.1.5, <1.2.0>=1.2.0","Affected versions of the crate have a bug where attacker-controlled
input can result in the use of an out-of-bound array index.  Rust
detects the use of the out-of-bound index and causes the application
to panic.  An attacker may be able to use this to cause a
denial-of-service.  However, it is not possible for an attacker to
read from or write to the application's address space. Advisory available underCC0-1.0license."
NA,Out-of-bounds array access leads to panic,"May 16, 2023","May 31, 2023(last modified: June 13, 2023)",sequoia-openpgp(crates.io),/packages/sequoia-openpgp.html,Vulnerability,denial-of-service,,"{'text': 'GHSA-25mx-8f3v-8wh7', 'url': 'https://github.com/advisories/GHSA-25mx-8f3v-8wh7'}","{'text': 'https://lists.sequoia-pgp.org/hyperkitty/list/announce@lists.sequoia-pgp.org/thread/SN2E3QRT4DMQ5JNEK6VIN6DJ5SH766DI/', 'url': 'https://lists.sequoia-pgp.org/hyperkitty/list/announce@lists.sequoia-pgp.org/thread/SN2E3QRT4DMQ5JNEK6VIN6DJ5SH766DI/'}, {'text': 'https://gitlab.com/sequoia-pgp/sequoia/-/tags/openpgp%2Fv1.16.0', 'url': 'https://gitlab.com/sequoia-pgp/sequoia/-/tags/openpgp%2Fv1.16.0'}",">=1.1.1, <1.2.0>=1.8.1, <1.9.0>=1.16.0","Affected versions of the crate have several bugs where
attacker-controlled input can result in the use of an out-of-bound
array index.  Rust detects the use of the out-of-bound index and
causes the application to panic.  An attacker may be able to use this
to cause a denial-of-service.  However, it is not possible for an
attacker to read from or write to the application's address space. Advisory available underCC0-1.0license."
NA,Resource exhaustion vulnerability in h2 may lead to Denial of Service (DoS),"April 14, 2023","April 20, 2023",h2(crates.io),/packages/h2.html,Vulnerability,denial-of-service,,"{'text': 'CVE-2023-26964', 'url': 'https://cve.mitre.org/cgi-bin/cvename.cgi?name=CVE-2023-26964'}, {'text': 'GHSA-f8vr-r385-rh5r', 'url': 'https://github.com/advisories/GHSA-f8vr-r385-rh5r'}","{'text': 'https://github.com/hyperium/hyper/issues/2877', 'url': 'https://github.com/hyperium/hyper/issues/2877'}",>=0.3.17,"If an attacker is able to flood the network with pairs ofHEADERS/RST_STREAMframes, such that theh2application is not able to accept them faster than the bytes are received, the pending accept queue can grow in memory usage. Being able to do this consistently can result in excessive memory use, and eventually trigger Out Of Memory. This flaw is corrected inhyperium/h2#668, which restricts remote reset stream count by default. Advisory available underCC0-1.0license."
NA,TLS certificate common name validation bypass,"March 24, 2023","March 25, 2023(last modified: November  8, 2023)",nats(crates.io),/packages/nats.html,Vulnerability,crypto-failure,,"{'text': 'GHSA-wvc4-j7g5-4f79', 'url': 'https://github.com/advisories/GHSA-wvc4-j7g5-4f79'}",>=0.24.1,<0.9.0,"The NATS official Rust clients are vulnerable to MitM when using TLS. The common name of the server's TLS certificate is validated against
thehostname provided by the server's plaintextINFOmessage
during the initial connection setup phase. A MitM proxy can tamper with
thehostfield's value by substituting it with the common name of a
valid certificate it controls, fooling the client into accepting it. Advisory available underCC0-1.0license."
NA,TLS certificate common name validation bypass,"March 24, 2023","March 25, 2023(last modified: June 13, 2023)",async-nats(crates.io),/packages/async-nats.html,Vulnerability,crypto-failure,,"{'text': 'GHSA-f5v5-ccqc-6w36', 'url': 'https://github.com/advisories/GHSA-f5v5-ccqc-6w36'}","{'text': 'https://github.com/nats-io/nats.rs/commit/817a7b942c462fa9d9938dcb62124173634132fb#diff-767d442397fcaaf2f83e8f924d4a70317a2ce4703a49964d6007707949cfa5f5L303-R304', 'url': 'https://github.com/nats-io/nats.rs/commit/817a7b942c462fa9d9938dcb62124173634132fb#diff-767d442397fcaaf2f83e8f924d4a70317a2ce4703a49964d6007707949cfa5f5L303-R304'}",>=0.29.0,"The NATS official Rust clients are vulnerable to MitM when using TLS. The common name of the server's TLS certificate is validated against
thehostname provided by the server's plaintextINFOmessage
during the initial connection setup phase. A MitM proxy can tamper with
thehostfield's value by substituting it with the common name of a
valid certificate it controls, fooling the client into accepting it. Advisory available underCC0-1.0license."
NA,opensslX509Extension::newandX509Extension::new_nidnull pointer dereference,"March 24, 2023","March 23, 2023(last modified: June 13, 2023)",openssl(crates.io),/packages/openssl.html,Vulnerability,denial-of-service,"{'text': 'GHSA-6hcf-g6gr-hhcr', 'url': 'https://github.com/advisories/GHSA-6hcf-g6gr-hhcr'}","{'text': 'https://github.com/sfackler/rust-openssl/pull/1854', 'url': 'https://github.com/sfackler/rust-openssl/pull/1854'}",>=0.10.48,Version,"<0.10.48, >=0.9.7","<0.10.48, >=0.9.7",These functions would crash when the context argument was None with certain extension types. Thanks to David Benjamin (Google) for reporting this issue. Advisory available underCC0-1.0license.,openssl;;x509;;x509extension;;new,"<0.10.48, >=0.9.7"
NA,opensslSubjectAlternativeNameandExtendedKeyUsage::otherallow arbitrary file read,"March 24, 2023","March 23, 2023(last modified: June 13, 2023)",openssl(crates.io),/packages/openssl.html,Vulnerability,file-disclosure,"{'text': 'GHSA-9qwg-crg9-m2vc', 'url': 'https://github.com/advisories/GHSA-9qwg-crg9-m2vc'}","{'text': 'https://github.com/sfackler/rust-openssl/pull/1854', 'url': 'https://github.com/sfackler/rust-openssl/pull/1854'}",>=0.10.48,Version,"<0.10.48, >=0.9.7","<0.10.48, >=0.9.7","SubjectAlternativeNameandExtendedKeyUsagearguments were parsed using the OpenSSL
functionX509V3_EXT_nconf. This function parses all input using an OpenSSL mini-language
which can perform arbitrary file reads. Thanks to David Benjamin (Google) for reporting this issue. Advisory available underCC0-1.0license.",openssl;;x509;;extension;;extendedkeyusage;;other,"<0.10.48, >=0.9.7"
NA,opensslX509NameBuilder::buildreturned object is not thread safe,"March 24, 2023","March 23, 2023(last modified: June 13, 2023)",openssl(crates.io),/packages/openssl.html,Vulnerability,thread-safety,"{'text': 'GHSA-3gxf-9r58-2ghg', 'url': 'https://github.com/advisories/GHSA-3gxf-9r58-2ghg'}","{'text': 'https://github.com/sfackler/rust-openssl/pull/1854', 'url': 'https://github.com/sfackler/rust-openssl/pull/1854'}",>=0.10.48,Version,"<0.10.48, >=0.9.7","OpenSSL has amodifiedbit that it can set on onX509_NAMEobjects. If this
bit is set then the object is not thread-safe even when it appears the code is
not modifying the value. Thanks to David Benjamin (Google) for reporting this issue. Advisory available underCC0-1.0license.",openssl;;x509;;x509namebuilder;;build,"<0.10.48, >=0.9.7"
NA,NULL pointer dereference instb_image,"March 19, 2023","March 19, 2023(last modified: July 15, 2023)",stb_image(crates.io),/packages/stb_image.html,Vulnerability,memory-corruption,,"{'text': 'GHSA-ppjr-267j-5p9x', 'url': 'https://github.com/advisories/GHSA-ppjr-267j-5p9x'}","{'text': 'https://github.com/servo/rust-stb-image/pull/102', 'url': 'https://github.com/servo/rust-stb-image/pull/102'}",>=0.2.5,"A bug in error handling in thestb_imageC library could cause a NULL pointer dereference when attempting to load an invalid or unsupported image file.  This is fixed in version 0.2.5 and later of thestb_imageRust crate, by patching the C code to correctly handle NULL pointers. Thank you to GitHub user 0xdd96 for finding and fixing this vulnerability. Advisory available underCC0-1.0license."
